,author,subreddit,body,id,link_id,created_utc,created,permalink
0,Sunsmiling,CanadianInvestor,"MAYBE I CAN SHARE MY EXPERIENCE.  
WHEN BEZOS AND MUSK SOLD THEIR STOCK, I SOLD MINE TOO. I SOLD AMZN FOR $3530 AND TSLA FOR $1180, SO I'M SELLING HIGH. AT THAT TIME MY ACCOUNT INCREASED BY 120K PROFIT.  
AFTER THAT, I STARTED SHORTING, I KEPT SHORTING TSLA AND AMZN, WHICH BROUGHT ME OVER 250K IN PROFIT (INCLUDING 120K IN GOLD I BOUGHT HERE).  
ONE BACK AND FORTH AND I'VE MADE 390K. BUT A LOT OF PEOPLE JUST WATCH THEIR PROFITS INCREASE AS THE STOCK MARKET GOES UP AND THEN DISAPPEAR WHEN THE STOCK MARKET GOES DOWN.  
  
ALSO, I THINK A DIVERSIFIED INVESTMENT STRATEGY SHOULD BE PRACTICED, WHICH IS THE GREATEST INVESTMENT STRATEGY OF THE 20TH CENTURY. FROM A LONG-TERM INVESTMENT PERSPECTIVE, THE BEST DIVERSIFICATION STRATEGIES ARE COMPREHENSIVE, INCLUDING DIVERSIFICATION AGAINST INFLATION, FINANCIAL CRISES, AND SOCIAL UNREST.  
WE CAN SELECTIVELY INVEST 40%-60% OF OUR CASH IN THE STOCK MARKET. IN THE STOCK MARKET, WE STILL FOLLOW A DIVERSIFIED INVESTMENT STRATEGY. INCLUDING TECHNOLOGY STOCKS, ENERGY STOCKS, CONSUMER STOCKS, FINANCIAL STOCKS, MEDICAL STOCKS AND EVEN INDICES, ETC., YOU CAN REFER TO MSFT/AAPL/CO/TSLA/XOM, ETC.;  
  
BUT THAT DOESN'T MEAN INVESTING NOW.  
AT PRESENT, DOMESTIC INFLATION IS VERY SERIOUS AND HAS EXCEEDED THE HIGHEST VALUE IN 40 YEARS. SOME FED OFFICIALS SAID A RATE HIKE WAS IMMINENT. THAT MEANS THE STOCK MARKET COULD FALL SHARPLY. AND, HISTORICALLY, FINANCIAL MARKETS HAVE HAD A FINANCIAL CRISIS EVERY 10 TO 20 YEARS. THE CURRENT SITUATION IS HIGH PRICES, HIGH HOUSING PRICES, HIGH INFLATION, AND HIGH DEBT. THE BASIC CONDITIONS FOR THE FINANCIAL CRISIS ARE ALREADY IN PLACE.  
SO, NOW IS DEFINITELY NOT THE BEST TIME TO INVEST.",hyqdp5y,t3_t2sh4x,1646018651,1646043851.0,/r/CanadianInvestor/comments/t2sh4x/31_starting_a_family_started_investing_during_the/hyqdp5y/
1,Sportfreunde,CanadianInvestor,"I WOULD SKIP THE TSLA AND ALSO ANY THEMATIC STOCK ETF LIKE TEC.TO UNLESS IT'S SOME SORT OF ASSET-SPECIFIC THEMATIC ETF LIKE A GOLD OR COVERED CALLS X ASSET OR BITCOIN ETC TYPE ETF. AND ONLY THEN IT'D BE A SMALL PORTION OF THE PORTFOLIO.

VFV IS FINE BUT IT'S NOT DIVERSE ENOUGH FOR ME PERSONALLY, XEQT IS QUITE DIVERSE BUT THOUGH OVERWEIGHTED CANADA HERE (IT'S 25% CANADA, I THINK IT SHOULD BE AROUND 5 OR MAYBE 10 MAX).",hyowuzt,t3_t2sh4x,1645995471,1646020671.0,/r/CanadianInvestor/comments/t2sh4x/31_starting_a_family_started_investing_during_the/hyowuzt/
2,Fitlyf2000,CanadianInvestor,"IF YOU’RE OPTIMISTIC ABOUT COMPANIES LIKE TSLA. INVEST IN TEC INSTEAD. BOTH VFV AND XEQT HOLD TSLA ALREADY. TESLA IS TOO VOLATILE FOR ME.
AND THEN YOU CAN ALSO LOOK TOWARDS REITS AND FINANCIAL STOCKS, ENERGY STOCKS, ETC.AND EVEN BUY SOME PHYSICAL GOLD. BUT XEQT IS THE BEST LONGTERM.",hyociic,t3_t2sh4x,1645987451,1646012651.0,/r/CanadianInvestor/comments/t2sh4x/31_starting_a_family_started_investing_during_the/hyociic/
3,True-Mail-938,CanadianInvestor,"WHAT IS THE POINT OF SPLITTING SHARES? WE ARE NOT TALKING ABOUT BRK SHARES OR EVEN TSLA IN THE 700S. 

I MEAN WOULD ANYONE BUY MORE SHARES CAUSE IT COST 50% NOW? ARE THERE FOLKS OUT THERE SAYING ""DAMN, WISH IT WAS HALF THE PRICE SO I CAN BUY SHARE""?",hyiip9x,t3_t12jm9,1645883728,1645908928.0,/r/CanadianInvestor/comments/t12jm9/cibc_smashes_q1_profit_estimates_plans_to_split/hyiip9x/
4,PFttsin,CanadianInvestor,WHAT WAS THE TSLA OF WW2?,hydvift,t3_t11chl,1645800231,1645825431.0,/r/CanadianInvestor/comments/t11chl/daily_discussion_thread_for_february_25_2022/hydvift/
5,No_Flamingo8089,CanadianInvestor,"I HAD TO TAKE A LOT OF RISK AND LIABILITY TO HAVE A BUSINESS OPERATING. I TOOK THOSE RISKS BY HAVING A BIT OF AN UNDERSTANDING OF MY CRAFT, AND BUILDING MY SKILL SET FROM THERE. 

I HAVE NO MORE ROOM TO TAKE MUCH RISK. IT’S LIKE REAL ESTATE, I DON’T WANT MY HOUSE TO MAKE ME MONEY, JUST KEEP UP WITH THE COST OF CAPITAL AND HOPEFULLY A LITTLE EXTRA.

INVESTING IS A WORMHOLE, ONCE YOU START LOOKING YOU GET OVERWHELMED WITH CONTRADICTORY INFORMATION, STRATEGIES ETC. IF YOU THINK I’M GOING TO TAKE ADVICE ON HERE AND INVEST TODAY YOU’RE WRONG. BUT WHAT I CAN DO IS START TO LOOK INTO DIFFERENT THINGS AND MAKE AN INFORMED DECISION FROM THERE (LIKE $TSLA FROM TSLA-MMED-SPCE). 

THEN MAYBE I BECOME MORE ENGAGED IN CONVERSATIONS IN THIS GROUP AND BRING MY EXPERIENCE/KNOWLEDGE TO THE GROUP ONE DAY WHEN IT IS APPLICABLE.

THOUGHTS?",hydmy6e,t3_t0vxmy,1645796257,1645821457.0,/r/CanadianInvestor/comments/t0vxmy/where_to_invest/hydmy6e/
6,TSLA-MMED-SPCE,CanadianInvestor,"IF YOU DON’T OWN $TSLA YOU’RE MAKING A MISTAKE.   I SAY THAT WITH THE UTMOST CONFIDENCE. STILL A LOT OF FUD SURROUNDS THE COMPANY BUT SOME PROPER IN DEPTH RESEARCH WILL EASILY SHUT OUT THAT NOISE. I PROMISE YOU THAT IF YOU GO DOWN THE TESLA RABBIT HOLE YOU’LL UNDERSTAND WHAT I MEAN. 

(I EXPECT TO BE DOWNVOTED FOR THIS COMMENT. I’M USED TO IT)",hydie5b,t3_t0vxmy,1645793845,1645819045.0,/r/CanadianInvestor/comments/t0vxmy/where_to_invest/hydie5b/
7,CommitteeOk84,CanadianInvestor,"TSLA: DOWN 35% YTD (TESLA)

SHOP: DOWN 53% YTD (SHOPIFY)

PYPL: DOWN 48% YTD (PAYPAL)

META: DOWN 40% YTD (FACEBOOK)

FORD: DOWN 20% YTD (FORD)

ATT: DOWN 7% YTD (AT&AMP;T)

MCD: DOWN 7% YTD (MCDONALDS)

SBUX: DOWN 22% YTD (STARBUCKS)

HD: DOWN 24% YTD (HOME DEPOT)

MEANWHILE MOLSON/COORS IS UP 5% TODAY HAHAHAH",hy4z050,t3_szmf9n,1645644310,1645669510.0,/r/CanadianInvestor/comments/szmf9n/im_not_seeing_the_stock_market_drop_that_people/hy4z050/
8,crownpr1nce,CanadianInvestor,"IT SEEMS TO BE PLENTY LIQUID. 96K VOLUME IS NOT SUPER LOW AND THE LAST TRADE WAS LESS THAN A FEW MINUTES AGO.

BUT IT'S DEFINITELY NOT TRADED NEARLY AS MUCH AS TSLA THAT'S FOR SURE.",hxzmids,t3_syssmn,1645551851,1645577051.0,/r/CanadianInvestor/comments/syssmn/liquidity_on_neo_cdrs/hxzmids/
9,fssg_shermanator,CanadianInvestor,SOLD TSLA TODAY. FIGURED CASHING OUT WITH A 50% GAIN IN 8 MONTHS BEATS THE ROLLERCOASTER. DEBATING THROWING IT INTO TOU OR JUST HOLDING IT IN CASH FOR A BIT TO SEE IF THERE'S A GOOD BUYING OPPORTUNITY WHEN INTEREST RATES RISE.,hxz0d3e,t3_sykv0a,1645543156,1645568356.0,/r/CanadianInvestor/comments/sykv0a/daily_discussion_thread_for_february_22_2022/hxz0d3e/
10,whiskyandme,CanadianInvestor,TSLA ALWAYS,hxxq843,t3_syc9mg,1645512716,1645537916.0,/r/CanadianInvestor/comments/syc9mg/dow_futures_drop_around_500_points_as_tensions/hxxq843/
11,Training_Exit_5849,CanadianInvestor,"BAM IS A GOOD ONE TO HOLD BECAUSE RENEWABLE IS ONLY ONE PART OF THEIR PORTFOLIO. OUR OLD BANK OF CANADA GOVERNOR MARK CARNEY IS PART OF THE BROOKFIELD GROUP NOW AND HE'S BIG INTO RENEWABLES SO YOU'LL DEFINITELY SEE THEM MAKE A BIG PUSH INTO THE SECTOR.

I THINK AS SOMEONE SAID, RIGHT NOW IT'S AN ETHICAL CHOICE, NOT QUITE A FINANCIAL CHOICE FOR MOST TO INVEST IN, NOT BECAUSE IT ISN'T THE FUTURE, BUT THERE'S SO MUCH COMPANIES THAT MOST LIKELY WON'T MAKE IT TO THE END.

I THINK AS THE GOVERNMENT THROW MORE MONEY INTO THE GREEN SECTOR, THERE WILL BE SOME GREAT WINNERS (LIKE TSLA), BUT YOU GOT TO DO YOUR OWN DUE DILIGENCE AND ACTUALLY INVEST IN A COMPANY BASED ON SOLID FUNDAMENTALS AND VISION AND NOT JUST THE GREEN HYPE TRAIN LIKE TECH WAS AT A FEW MONTHS AGO.",hxmvfk4,t3_swh9va,1645311286,1645336486.0,/r/CanadianInvestor/comments/swh9va/renewables/hxmvfk4/
12,bronze-aged,CanadianInvestor,"I’M BUYING SOME CLEAN ENERGY ON THIS ENDLESS DIP 

TSLA ENPH STEM",hxm0our,t3_swh9va,1645297978,1645323178.0,/r/CanadianInvestor/comments/swh9va/renewables/hxm0our/
13,Healthy_Apartment_32,CanadianInvestor,"HAVEN’T LOOKED INTO IT. THE GREAT THING ABOUT ETFS IS THEY’RE AUTOMATICALLY REBALANCED, SO TSLA CAN GET THE BOOT IF ITS MARKET CAP NO LONGER QUALIFIES.",hximrw5,t3_svf9tw,1645229913,1645255113.0,/r/CanadianInvestor/comments/svf9tw/daily_discussion_thread_for_february_18_2022/hximrw5/
14,Synopog,CanadianInvestor,"BOUGHT SHOP AT $665 AND TSLA AT $878. 

NEVER THOUGHT I WOULD BUY THESE BUT SEEMED LIKE A GOOD DEAL.",hxd58l8,t3_suz7e7,1645134670,1645159870.0,/r/CanadianInvestor/comments/suz7e7/after_hours_discussion_thread_for_february_17_2022/hxd58l8/
15,otisreddingsst,CanadianInvestor,WHY DON'T YOU JUST BUY THE STOCK.  TSLA,hxbmlve,t3_suqkl2,1645114184,1645139384.0,/r/CanadianInvestor/comments/suqkl2/teslane/hxbmlve/
16,Anonmonyus,CanadianInvestor,WELL YOU HAVE 3 OPTIONS 1)ALL IN ON TSLA SHORT DATED CALLS. 2) BITCOIN OR 3) COPY NANCY PELOSI,hx8lqw0,t3_su2ufr,1645053835,1645079035.0,/r/CanadianInvestor/comments/su2ufr/have_700k_to_invest_for_6_months_to_1_year/hx8lqw0/
17,Azkatchy,CanadianInvestor,"I DIDN'T KNOW THERE WAS A CAD-HEDGED VERSION OF TSLA. COULD YOU TELL ME WHAT TICKER SYMBOL IT IS?

&AMP;#X200B;

ALSO I WOULD SAY THAT THE MAIN ADVANTAGE OF HAVING A CAD-HEDGED VERSION WOULD BE THE FACT THAT YOU'RE AVOIDING CONVERSION FEES. IF YOU'RE WITH WEALTHSIMPLE TRADE, YOU WILL PAY A 1,5% SPREAD FEE ON TOP OF THE CURRENT EXCHANGE RATE OF CAD/USD AND UPON THE RESALE, YOU WILL ALSO PAY ANOTHER 1,5% WHICH CAN ADD UP TO A LOT.

IF YOU USE QUESTRADE, IT IS A 2% SPREAD FEE. THAT BEING SAID, QUESTRADE ALLOWS FOR THE NORBERT GAMBIT METHOD THAT COMPLETELY ELIMINATES THE SPREAD FEE (YOU CAN DO SOME RESEARCH ON THAT METHOD IF YOU'RE NOT FAMILIAR WITH IT).

&AMP;#X200B;

THE SECOND ADVANTAGE IS THAT YOU ARE NOT VULNERABLE TO THE FLUCTUATION IN THE US DOLLAR'S VALUE RELATIVE TO THE CAD DOLLAR'S VALUE.

IF YOU BUY THE CAD-HEDGED VERSION OF TSLA, A DROP IN THE US DOLLAR'S VALUE RELATIVE TO THE CAD DOLLAR'S VALUE WOULD NOT AFFECT YOUR GAINS WHATSOEVER.

THAT BEING SAID, IF YOU HAD BOUGHT A REGULAR TSLA SHARE AND THE USD WENT UP IN VALUE RELATIVE TO THE CAD, THEN YOU WOULD TECHNICALLY HAVE MADE MORE MONEY BECAUSE YOUR TSLA SHARES ARE IN USD AND BY HOLDING THEM, YOU INDIRECTLY HOLD USD WHICH WOULD BE WORTH MORE THAN CAD DOLLARS.",hx29udg,t3_st5pl3,1644947927,1644973127.0,/r/CanadianInvestor/comments/st5pl3/cad_hedged_stocks/hx29udg/
18,crownpr1nce,CanadianInvestor,"OR IT COULD HAVE KEPT SKYROCKETING TO A POINT HE (AND I, SIMILAR SITUATION) COULDN'T AFFORD IT EVER. 

I COULD HAVE BOUGHT TSLA OR BTC 10 YEARS AGO, I DIDN'T. I COULD HAVE BOUGHT A HOUSE 5 YEARS AGO, BUT I DIDN'T. SOMETIMES YOU WIN, SOMETIMES YOU LOSE. IF YOU TRY TO ALWAYS WIN YOU'LL LIKELY JUST SIT ON THE SIDELINES FOREVER. IT GOES UP: YOU WAIT FOR IT TO COME DOWN. IT GOES DOWN, IT'S SCARY THAT YOU COULD LOSE VALUE TOMORROW SO YOU WAIT FOR IT TO BOTTOM OUT. THEN IT STARTS TO GO UP AND YOU WAIT AND SEE IF IT'S A FAKE REBOUND, RINSE AND REPEAT.",hwywac5,t3_ssd3wb,1644881763,1644906963.0,/r/CanadianInvestor/comments/ssd3wb/posthaste_why_a_20_plunge_in_home_prices_wont/hwywac5/
19,GamblingMikkee,CanadianInvestor,TSLA APPARENTLY,hwxka2g,t3_ss80nu,1644860317,1644885517.0,/r/CanadianInvestor/comments/ss80nu/daily_discussion_thread_for_february_14_2022/hwxka2g/
20,rahuliyer80,CanadianInvestor,"GOOGLE ,PROBABLY THE MOST MOATY BUSINESS IN THE WORLD CURRENTLY,  BAM , TD , MCD OR DOMINOES &AMP; TSLA  IF YOU HAVE A LONG TIMELINE",hwv6dyq,t3_sro0hk,1644808900,1644834100.0,/r/CanadianInvestor/comments/sro0hk/set_and_forget_stock_for_kids/hwv6dyq/
21,awaythrow12314,CanadianInvestor,TSLA 925P VOLUME TODAY WAS 1572.,hwlww18,t3_sqiod1,1644643362,1644668562.0,/r/CanadianInvestor/comments/sqiod1/instagram_stock_gurus/hwlww18/
22,fullsupporting,CanadianInvestor,RUSSIA SAID THEY WILL NOT INVADE IF TSLA STOCK STOCK GO TO $1500,hwlnud8,t3_sq6pri,1644638510,1644663710.0,/r/CanadianInvestor/comments/sq6pri/russia_to_invade_ukraine_sources/hwlnud8/
23,Sad-Man-5805,CanadianInvestor,"TSLA, MSFT, GOOG, NFLX, WLMT, COST, &AMP; AMZN AMONG A FEW OTHER ETFS IN DIFFERENT SECTORS AND MINERAL MINING",hwjzj5o,t3_sq7y8q,1644612675,1644637875.0,/r/CanadianInvestor/comments/sq7y8q/averaging_down_on_a_loss/hwjzj5o/
24,defnotjackiec,CanadianInvestor,"GIVES COMPANIES WAYS TO GAME THE SYSTEM. 

INCIDENTALLY, UP UNTIL SOME TIME LAST YEAR TSLA RELIED ON SELLING CARBON CREDITS.",hwf2f5n,t3_sow4e7,1644526383,1644551583.0,/r/CanadianInvestor/comments/sow4e7/horizons_launches_canadas_first_carbon_credit_etf/hwf2f5n/
25,toookoool,CanadianInvestor,AND TSLA IS GROWING AT 40-50% NEXT 4-5 YEARS AT LEAST,hvqb43f,t3_sknbf5,1644088183,1644113383.0,/r/CanadianInvestor/comments/sknbf5/i_messed_up_really_bad/hvqb43f/
26,art4020,CanadianInvestor,"FOR THE LONGEST TIME I USE TO HOLD THE ESPP AND RSU BUT THEN I REALIZED I COULD BE MAKING MORE MONEY BY SELLING IT AND MOVING IT TO A TFSA OR RRSP ACCOUNT.

WHAT I DO NOW IS PARTICIPATE IN ESPP BUT SELL IT WITHIN A WEEK OF BEING GRANTED THE SHARES AND SEND RESULTING CASH OVER TO  TFSA/RRSP. THIS WAY I AM GUARANTEED TO MAKE 15% AND I AM NOT OVERLY INVESTED IN A SINGLE STOCK.

PS I BELIEVE THIS IS THE BEST OPTION UNLESS YOU WORK FOR GOOGLE APPLE MSFT FB OR TSLA IN WHICH CASE HOLD ON TO THE STOCKS 😃",hvpvzko,t3_sl9x4c,1644081195,1644106395.0,/r/CanadianInvestor/comments/sl9x4c/to_keep_rsus_or_to_reinvest_them_sell_espps/hvpvzko/
27,Unfair-Session-2551,CanadianInvestor,DON’T LISTEN TO ADVISE ON REDDIT. THAT’S MY ADVICE. WITH A LONG TIME HORIZON LOOK TO THE ARK OR BETTER FIND CONVICTION IN SOMETHING YOU BELIEVE IN. FOR ME THIS HAPPENED 2 YEARS AGO AND CONVERTED MY PORTFOLIO TO 95% TSLA. CONVICTION MATTERS. FIND WHAT DRIVES YOU AND BE FORWARD THINKING. INVESTING ON A 10 YEAR HORIZON IMPLORES FORWARD THINKING AND NEEDS CONVICTION. UNLESS YOU WANT MEDIOCRE GAINS…….,hvo7fmg,t3_sksk30,1644045116,1644070316.0,/r/CanadianInvestor/comments/sksk30/advice_for_a_newbie/hvo7fmg/
28,PFttsin,CanadianInvestor,"UMM. .. SHOP, LSPD, AAPL, TSLA, CTS, ARE ALL DOWN.  ONLY GOOG IS DOING ANYTHING SPECIAL ON MY LIST",hva5yhx,t3_silwwh,1643813683,1643838883.0,/r/CanadianInvestor/comments/silwwh/daily_discussion_thread_for_february_02_2022/hva5yhx/
29,TSLA-MMED-SPCE,CanadianInvestor,"I’D PUT 20% IN REAL ESTATE, 70% IN $TSLA, 5% IN $MMED, AND 5% IN BITCOIN &AMP; ETHEREUM.",huwbu5e,t3_sgeg6a,1643574624,1643599824.0,/r/CanadianInvestor/comments/sgeg6a/what_would_you_realistically_do_with_a_million/huwbu5e/
30,agnchls,CanadianInvestor,"I THINK IT'S ALSO A MATTER OF STYLE. US TECH IS A BLINDSPOT FOR ME. IT'S RICHLY VALUED, BUT IT'S EASY TO ARGUE HOW THESE VALUATIONS ARE APPROPRIATE. I DEFINITELY MISSED OUT ON PROFITS THERE.  


THAT SAID, I WOULD SAY I'M MORE OF A VALUE INVESTOR AND HAVE NO INTEREST IN ANYTHING ARKK IS HOLDING (DISRUPTION AKA. SMALL MID CAP GROWTH). I MAY MISS OUT ON THE NEXT TSLA, BUT I'M HAPPY BEING UP 2% YTD, WHILE THOSE HOLDINGS ARE DOWN 30%. STILL, I AM FULL RISK ON AS I HAVE HEAVY MARGIN USAGE.",huw8zgj,t3_sgeg6a,1643573551,1643598751.0,/r/CanadianInvestor/comments/sgeg6a/what_would_you_realistically_do_with_a_million/huw8zgj/
31,Disposable_Canadian,CanadianInvestor,"OH YOU ASSUME HE HAS CONTROL OVER THE STOCK PRICE NOW?  

&AMP;#X200B;

I JUST THINK HE WAS SMART AS HELL TO SELL WHEN HE DID, AND HE HOODWINKED EVERYONE IN THE PROCESS, AND THE STOCK PRICE HELD UP AS HE SOLD.

&AMP;#X200B;

HE STILL OWNS LOTS OF SHARES, BUT HE'S SET, AND AS THE MARKET CORRECTS AND CONTRACTS AND POTENTIALLY CRASHES, HE WILL BE FINE WHEN TSLA STOCK DROPS TO A LOWER AND MORE REALISTIC VALUATION.",huritn6,t3_sf5pp2,1643489057,1643514257.0,/r/CanadianInvestor/comments/sf5pp2/elon_sold_his_shares_and_now_hes_free_to_be_nuts/huritn6/
32,TheGreatCornolio682,CanadianInvestor,TSLA PUTS?,huo6p38,t3_sf4iz0,1643424560,1643449760.0,/r/CanadianInvestor/comments/sf4iz0/long_term_investors_in_this_sub_in_a_nutshell/huo6p38/
33,theupbeatrecurrence,CanadianInvestor,I'M BUTT HURT BECAUSE I FINALLY CROSSED THE THRESHOLD WHERE I NO LONGER WANNA HOLD $TSLA,huo5med,t3_sf5pp2,1643424066,1643449266.0,/r/CanadianInvestor/comments/sf5pp2/elon_sold_his_shares_and_now_hes_free_to_be_nuts/huo5med/
34,PFttsin,CanadianInvestor,MY BET IS THAT AS SOON AS THESE BIG AUTO COMPANIES HAVE THEIR VEHICLES HITTING THE ROAD THE VALUE OF TSLA WILL PLUMMET.  IN THE SHORT TERM IF IT SLIDES BELOW $600 THEN ITS REALLY GOING TO START TO FALL QUICKLY,humazfi,t3_seo8zb,1643396556,1643421756.0,/r/CanadianInvestor/comments/seo8zb/daily_discussion_thread_for_january_28_2022/humazfi/
35,Woodporter,CanadianInvestor,ELON IS LOOKING MORE GENIUS BY THE DAY AS TSLA PLUNGES WELL BELOW HIS SALE PRICE. HE KNEW.,hul73oc,t3_seo8zb,1643381666,1643406866.0,/r/CanadianInvestor/comments/seo8zb/daily_discussion_thread_for_january_28_2022/hul73oc/
36,goldbergew,CanadianInvestor,"PROFILE:  
33 YEAR OLD. TOTAL PORTFOLIO VALUE: 110K (55% TFSA, 45% RRSP)  
HOLDINGS SUMMARY BY ACCOUNT TYPE(PERCENTAGE ROUNDED TO THE CLOSEST FULL NUMBER):  
TFSA: 33% XEQT, 10% TSLA, 8% ITOT, 6% ATZ, 6% BMA.A, 6% TEC, 6% ATD, 5.5% FB, 4% GSY, 4% TD, 2.25 CP, 2.2% CNR, 2% EQB, 2% T  


RRSP: 44% XEQT, 13.5% MSFT, 10% AAPL, 10% TEC, 6% JWN, 5.5% BNS, 3% ENB, 2.5% DIS, 2.2% BLK, 1.6% BMO, 1.6% FTS",hujpptt,t3_rth8cj,1643348472,1643373672.0,/r/CanadianInvestor/comments/rth8cj/rate_my_portfolio_megathread_for_january_2022/hujpptt/
37,Introvert4JC,CanadianInvestor,"I'M A BUYER OF TSLA WHEN IT COMES BACK DOWN TO PRE-COVID LEVELS. YOU KNOW, THE $100 MARK.",huiuvys,t3_se8j6o,1643334042,1643359242.0,/r/CanadianInvestor/comments/se8j6o/after_hours_discussion_thread_for_january_27_2022/huiuvys/
38,Healthy_Apartment_32,CanadianInvestor,"TO ADD TO THIS: ELON WOULDN’T HAVE EXERCISED HIS STOCK OPTIONS, EVEN THOUGH THERE’S NOTHING HOLDING BACK FROM DOING SO, IF HE THOUGHT THE COMPANY WAS STILL UNDERVALUED. FACT OF THE MATTER IS HE SOLD BILLIONS, CASHING IN ON THE FANATICAL IDIOCY OF TSLA “INVESTORS”. 

WHAT SUCKS MORE, THOUGH, IS HOW TSLA IS GOING TO ADVERSELY AFFECT THE NASDAQ.",hui3yc8,t3_sdvudb,1643322925,1643348125.0,/r/CanadianInvestor/comments/sdvudb/daily_discussion_thread_for_january_27_2022/hui3yc8/
39,WrongYak34,CanadianInvestor,"VERY UNTRUE OF THE QUALITY AND FINISH IT DELIVERS. FEW PEOPLE I KNOW THAT HAVE IT ALWAYS HAVE PROBLEMS. STUCK IN CAR WASH MODE, HEATERS STOPPED WORKING IN THE WINTER ETC…

THE NEXT PTON IS ABSURD THOUGH BUT TSLA IS ONE OF THOSE THINGS WHERE IT DOESN’T DESERVE THIS VALUATION JUST LIKE PTON HAD BEFORE IT CAME DOWN TO EARTH",huhaem9,t3_sdvudb,1643311937,1643337137.0,/r/CanadianInvestor/comments/sdvudb/daily_discussion_thread_for_january_27_2022/huhaem9/
40,Healthy_Apartment_32,CanadianInvestor,TSLA IS THE NEXT PTON,huh7bdn,t3_sdvudb,1643310803,1643336003.0,/r/CanadianInvestor/comments/sdvudb/daily_discussion_thread_for_january_27_2022/huh7bdn/
41,migbyo,CanadianInvestor,"\*SIDE-GLANCE AT TSLA\* WELL, BACK TO PENNY STOCKS FOR ME!

FAVOURITE JUNIOR BATTERY METALS MINER?",huglpeh,t3_sdvudb,1643303122,1643328322.0,/r/CanadianInvestor/comments/sdvudb/daily_discussion_thread_for_january_27_2022/huglpeh/
42,Buteo-Lagopus,CanadianInvestor,HTTPS://WWW.NASDAQ.COM/MARKET-ACTIVITY/STOCKS/TSLA/INSTITUTIONAL-HOLDINGS,hu93qsk,t3_sctow4,1643170716,1643195916.0,/r/CanadianInvestor/comments/sctow4/national_bank_buys_over_600m_worth_of_shares_in/hu93qsk/
43,swooneytoad,CanadianInvestor,"I MEAN IF YOU OWN SPY OR VTI, YOU PROBABLY OWN TSLA TOO. NOTHING SPECIAL ABOUT THIS MOVE.",hu8z8hj,t3_sctow4,1643168599,1643193799.0,/r/CanadianInvestor/comments/sctow4/national_bank_buys_over_600m_worth_of_shares_in/hu8z8hj/
44,psmgx,CanadianInvestor,"&GT; THE GENERAL TREND WAS SHE WOULD MAKE A REALLY RISKY PLAY AND MAKE REALLY GOOD MONEY BUT THEN SHE WOULD MAKE ANOTHER RISKY MOVE AND LOSE A LOT OF MONEY AND THEN MOVE FUNDS AND RINSE AND REPEAT.

SO STANDARD BEHAVIOR FOR HEDGE FUNDS? 

DIFFERENCE WITH CATHIE WOODS IS THAT 1) SHE'S A CHICK, AND 2) THAT SHE WENT HARD ON A FEW POPULAR TECH STOCKS, ESP. TSLA, WHICH GOT SOME ATTENTION.",hu5ikoo,t3_sbds7q,1643119118,1643144318.0,/r/CanadianInvestor/comments/sbds7q/warren_buffett_closes_in_on_cathie_wood_as_tech/hu5ikoo/
45,financialnavigatorX,CanadianInvestor,JUST ADDED TO MY APPLE POSITION. AND CONSIDERING ADDING TO TSLA. THERE YOU GO,hu5i15r,t3_sb6dfq,1643118865,1643144065.0,/r/CanadianInvestor/comments/sb6dfq/is_now_the_time_to_buy/hu5i15r/
46,Extra_Past1148,CanadianInvestor,"DOWN -10K OR 9%. WAS UP 20% JUST THREE MONTHS AGO AND THE PAST WEEK WIPED OUT MY ENTIRE GAINS FROM 2021. I HAVE A MIXED PORTFOLIO WITH LARGEST HOLDINGS BEING TSLA, AAPL, FB, GOOG, AND INDEX FUNDS. MY GROWTH STOCKS LIKE PLTR, OPEN GOT ABSOLUTELY DESTROYED. NOT WORRIED, WILL BUY THE DIP.",hu3c32g,t3_sbrbqn,1643072932,1643098132.0,/r/CanadianInvestor/comments/sbrbqn/well_i_finally_did_it_5_figures/hu3c32g/
47,bramptonin,CanadianInvestor,"ALMOST EVERYTHING I HAVE IS DOWN INCLUDING SOME OF THE GOOD STOCKS MSFT, AMD, SHOP.TO, FB, AAPL, JPM, NFLX, NVDA, PYPL, TSLA, WMT, AMZN, GOOG, SOME OTHER LIKE PLTR, TWITTER, BABA, NIO, NIKOLA, MODERNA AND LOTS OF CRAP STUFF I HAVE",hu2cwld,t3_sbrbqn,1643056115,1643081315.0,/r/CanadianInvestor/comments/sbrbqn/well_i_finally_did_it_5_figures/hu2cwld/
48,Jiznthapus,CanadianInvestor,BTC TSLA VEQT,hu1yed5,t3_sbrnlj,1643050598,1643075798.0,/r/CanadianInvestor/comments/sbrnlj/what_are_we_buying_today/hu1yed5/
49,Syzygy_____,CanadianInvestor, YOU'VE GOT BALLS OF STEEL PLAYING OPTIONS WITH TSLA. I REALLY HOPE TSLA COMES BACK DOWN TO REALITY BUT THIS STUPID FUCKING COMPANY IS BIZARRE AND MOVES WITHOUT RATIONALE. GOODLUCK AND GOD SPEED,hu1tpl2,t3_sbrnlj,1643048862,1643074062.0,/r/CanadianInvestor/comments/sbrnlj/what_are_we_buying_today/hu1tpl2/
50,786vivaankhan,CanadianInvestor,"MAYBE BUY TSLA, GIVEN THE FACT THE EARNINGS ARE COMING UP ON WEDNESDAY.",hu1nuxb,t3_sbrqae,1643046701,1643071901.0,/r/CanadianInvestor/comments/sbrqae/what_is_everyones_strategy_given_the_fact_that/hu1nuxb/
51,bramptonin,CanadianInvestor,"TSX: BAM.A, SHOP
US: MSFT, AMD, FB, AAPL, JPM, NFLX, NVDA, PYPL, TSLA, WMT, AMZN, GOOG",htw661i,t3_sa6s5t,1642954171,1642979371.0,/r/CanadianInvestor/comments/sa6s5t/new_investor_what_to_buy_during_this_potential/htw661i/
52,Godkun007,CanadianInvestor,"IT HAS A 0.6% YEARLY FEE FOR THE HEDGING. AS WELL, IT HAS LOWER VOLUME THAN THE NORMAL TSLA, SO IT MIGHT BE SLIGHTLY HARDER TO SELL. BESIDES THAT IT IS YOUR CHOICE WHETHER IT IS WORTH IT.",htoc9tg,t3_s9pctz,1642811548,1642836748.0,/r/CanadianInvestor/comments/s9pctz/what_is_tslato/htoc9tg/
53,iserendipitous,CanadianInvestor,"PERSONAL TFSA
TSLA - 2
LSPD.TO - 40
TEC.TO - 30
MMED - 50
CRWD - 4 
WELL.TO - 250
LCID - 50",htmak4l,t3_rth8cj,1642784106,1642809306.0,/r/CanadianInvestor/comments/rth8cj/rate_my_portfolio_megathread_for_january_2022/htmak4l/
54,Knowledge_Top,CanadianInvestor,"MY FEEDBACK WILL BE BASED ON HOW OLD YOU ARE AND WHEN YOU ARE PLANNING TO RETIRE.  IF YOU ARE 10 YEARS FROM RETIRING, I WOULD SAY THAT THIS PORTFOLIO IS FINE, HOWEVER IF YOU ARE YOUNGER AND BASED ON YOUR $2K RETURN PER YEAR YOU ARE ONLY MAKING 3.6% PER YEAR ON DIVS WITH POTENTIAL GROWTH.

IF YOU USE THE POWER TO 72 RULE TO CALCULATE HOW LONG THIS INVESTMENT WILL TAKE TO DOUBLE YOUR INITIAL INVESTMENT BY REINVESTING YOUR DIVIDENDS, IT COMES OUT TO 19.5 YEARS.  WILL THIS BE ENOUGH TO RETIRE?  MAY NEED TO DIVERSIFY INTO SOME GROWTH STOCKS TO BOOST YOUR NET WORTH?  I LIKE TECH RIGHT NOW AS THE STOCKS HAS BEEN BEATEN DOWN THIS YEAR (MSFT, GOOGL, TSLA -CAGR 50%/YR?).",hti95ae,t3_s8rx2x,1642711392,1642736592.0,/r/CanadianInvestor/comments/s8rx2x/rate_my_little_portfolio_2kyear_in_dividends_plus/hti95ae/
55,Seeking_Elation,CanadianInvestor,"DEF BY 3:30.

TRIED TO TIME A BUY FOR 3:01 BUT I BLEW IT LOL. I’M THINKING 3PM.

WOULDA THREW DOWN ON SOME SHOP TSLA AMZN DCAS FOR CLOSE TODAY",hti89v2,t3_s8ggpg,1642711067,1642736267.0,/r/CanadianInvestor/comments/s8ggpg/daily_discussion_thread_for_january_20_2022/hti89v2/
56,sarsa3,CanadianInvestor,"LOL, YES BRANDON WITH HIS 0.1 SHARE OF TSLA WILL MATTER MUCH.",htd5jy9,t3_s7s99p,1642624296,1642649496.0,/r/CanadianInvestor/comments/s7s99p/canadian_consumer_inflation_hits_highest_rate/htd5jy9/
57,migbyo,CanadianInvestor,"TO MY LIGHTS, ONLY TSLA AND VARIOUS BATTERY METALS ARE HOLDING UP BECAUSE THEY ACTUALLY HAVE FUNDAMENTALS.",ht8vora,t3_s77qqh,1642548855,1642574055.0,/r/CanadianInvestor/comments/s77qqh/after_hours_discussion_thread_for_january_18_2022/ht8vora/
58,darshanpatel4u,CanadianInvestor,WITH SPREADS I FIND YOU LOOSE EVERYTHING IF THE SPREAD GETS TESTED. ALSO YOU CANNOT GO LOWER SAFER. LETS SAY I CAN SELL TSLA 850 PUT FOR 410. WILL BE 300 SOMETHING TOMORROW BUT STILL I CAN DO IT. WITH A PUT SPREAD FOR 850 I WILL BE MAKING ONLY $ 100ISH PER SPREAD WITH 5K RISK. TO MITIGATE FOR NAKED I HAVE TO SELL 3X SPREADS WHICH BEARS HIGH COMISSIONS AS WELL. ALSO I CANNOT RIDE IT TO EXPIRY TOO.,ht4fwfg,t3_s6l121,1642472583,1642497783.0,/r/CanadianInvestor/comments/s6l121/comissions/ht4fwfg/
59,SuperOperation2449,CanadianInvestor,BUT DOESN’T IT REPLICATE PERFORMANCE OF ITS UNDERLYING HOLDING WHICH IS TSLA ON THE NYSE?,ht20akf,t3_s67vu3,1642437708,1642462908.0,/r/CanadianInvestor/comments/s67vu3/why_is_it_moving_so_much_if_actual_stock_on_us/ht20akf/
