,author,subreddit,body,id,link_id,created_utc,created,permalink
44,ZivSerb,CanadianInvestor,"YEAH I AM IN THE SAME BOAT. STEADY LOW BETA WITH A NICE DIVIDEND LIKE FTS, BCE/RCI, A FEW OF THE BIG BANKS, AND THEN MAYBE SOME ENERGY EXPOSURE LIKE ENB OR SU NOW THAT THE MULTIPLES AREN’T TOO INSANE. EVEN CONSUMER STAPLE LIKE DOL IS A SOLID STORY. THEY CAN HIKE PRICES BY A FEW CENTS, NO ONE BATS AN EYE, AND IT RAISES THEIR REVENUE CONSIDERABLY. NTR IS ALSO ONE I LIKE GOING FORWARD IN TERMS OF LONGER TERM INVESTMENTS. HEALTHY DIVIDEND, SOLID GROWTH POTENTIAL AS THE POPULATION CONTINUES TO RISE AND THUS DEMAND FOR AGRICULTURE, AND COMMODITIES ARE A DECENT PLACE TO BE. THAT AND A LITTLE GOLD EXPOSURE. I STILL THINK YOU HAVE TO TAKE A BITE OF US PRO GROWTH EXPOSURE IN A NAME LIKE AAPL, AMZN, MSFT, OR POSSIBLY EVEN CLOUD/CRM BUT IT’S EQUAL ALLOCATION  BETA ADJUSTMENT FOR YOUR RISK PROFILE. I DON’T NEED TO GET LAMBO RICH, JUST LOOKING TO NOT LOSE TO INFLATION. I EVEN HAVE SHORT TERM TREASURY BOND EXPOSURE RIGHT NOW, THE RATES ARE COMPELLING ENOUGH AND IMO WITH THE ECONOMIC DATA COMING OUT IT’S A CAPITAL PRESERVATION MARKET. PATIENCE IS OF VIRTUE. ",eh3wbur,t3_ath7vo,1550937193,1550962393.0,/r/CanadianInvestor/comments/ath7vo/rbc_hikes_dividend_4_challenging_market/eh3wbur/
45,etienner,CanadianInvestor,"MIDTERMS STRESS ME OUT AND I'M BEING A BITCH.  YOU DID NOTHING WRONG.

ALSO, THAT ""PSYCHOLOGICAL PREFERENCE"" IS ALSO THE PREFERENCE OF A LOT OF INVESTORS, AND THAT IS ONE OF THE REASON WHY DIVIDEND STOCKS CAN OUTPERFORM IN THE LONG RUN.  HOWEVER, A LOT OF GREAT COMPANIES DO NOT HAVE DIVIDENDS (BRK, AAPL BEFORE 2012, NETFLIX, ETC.).

DO YOU ALSO OWN BONDS? SOME BOND FUNDS CAN HAVE A YIELD OF 5%+ (I OWN ZEF WHICH HAS A 5% YIELD)",eh1qhw3,t3_at9sb5,1550861278,1550886478.0,/r/CanadianInvestor/comments/at9sb5/resp_what_would_you_do/eh1qhw3/
46,tree-farmer,CanadianInvestor,"I DON'T LIKE AAPL.  IF YOU'RE LOOKING FOR GROWTH, I THINK YOU'RE TOO LATE.  THEIR NEW IPHONES ARE ONLY INCREMENTALLY BETTER WITH EVER-INCREASING PRICE TAGS.  IT'S NO WONDER PEOPLE ARE UPGRADING LESS OFTEN.  PLUS THE ONGOING TRADE WAR IS CAUSING THEM PROBLEMS, AND I DON'T THINK THAT IS GETTING RESOLVED SOON.  NOT ONLY DO YOU HAVE 25% OF YOUR PORTFOLIO IN AAPL BUT IT'S ALSO IN BRK AND SPY.

ANOTHER ALMOST 30% OF YOUR PORTFOIO IS IN WEED STOCKS.  MAYBE IT KEEPS GOING UP FOR A WHILE, BUT I'D SAY IT'S A BUBBLE.  IF EVERYONE IS ALREADY TALKING ABOUT SOMETHING, YOU ARE PROBABLY TOO LATE.",egrila4,t3_arzmx4,1550532863,1550558063.0,/r/CanadianInvestor/comments/arzmx4/thoughts_on_my_portfolio/egrila4/
47,jcasablanc,CanadianInvestor,"YES, YOU ARE HEAVY ON THOSE TWO, AND ALSO OVERLAPPING (BRK HOLDS AAPL AND HMMJ HAS ACB). 

&AMP;#X200B;

BEING AGGRESSIVE IS FINE AT YOUR AGE, BUT WHY DID YOU CHOOSE THOSE SMALLER COMPANIES SPECIFICALLY? THEY ADD UP TO 13-14% OF YOUR HOLDINGS WHICH IS NOT BIG, BUT ALSO NOT SMALL. I WOULD PROBABLY PREFER HOLDING S&AMP;P 400 AND/OR S&AMP;P 600 FOR MID/SMALL CAP OPPORTUNITIES UNLESS I WAS REALLY COMFORTABLE WITH INDIVIDUAL COMPANIES. ALSO, IT SEEMS YOU DIDN'T ALLOW FOR ANY INTERNATIONAL EXPOSURE OUTSIDE OF US - ANY REASON?  
",egqqaar,t3_arzmx4,1550512356,1550537556.0,/r/CanadianInvestor/comments/arzmx4/thoughts_on_my_portfolio/egqqaar/
48,HEAT631,CanadianInvestor,"THANKS FOR THE ADVICE. I ACTUALLY AM QUITE INTERESTED IN STOCKS, THOUGH I STILL HAVE MUCH TO LEARN. I WAS LOOKING AT US STOCKS LIKE AAPL, MSFT, ADBE, DIS AND V BUT WAS CONCERNED THAT AFTER CONVERTING MY MONEY TO US$, IT'D TAKE A BIG HIT ON MY ROI. THEN I WAS LOOKING AT MOSTLY CANADIAN DIVIDEND STOCKS LIKE RBC AND TD. 

&AMP;#X200B;

WHAT KIND OF RETURN COULD I REASONABLY EXPECT FROM VGRO/XGRO Y/Y? ",egd8nxq,t3_aq3m4o,1550040883,1550066083.0,/r/CanadianInvestor/comments/aq3m4o/15000_to_invest_whats_the_best_approach/egd8nxq/
49,DonArcher007,CanadianInvestor,"ASIDE FROM THE USUAL SUSPECTS, (PG, PEP, AAPL, GM, ETC ETC)  SOME OF THE LESS POPULAR ONES I REALLY LIKE RIGHT NOW &AMP; AM BUYING: 

STOR
MPW
DWDP
 CCI
GLPI
CINF ",eg7ui6f,t3_apdlct,1549884964,1549910164.0,/r/CanadianInvestor/comments/apdlct/what_are_some_of_your_favourite_dividend_paying/eg7ui6f/
50,ZivSerb,CanadianInvestor,"NO NO, CIBC DID CHARGE ME WHT IN MY TFSA WHEN HOLDING A US DIVIDEND-PAYING EQUITY. I HELD XLF AND AAPL FOR A LARGE CHUNK OF LAST YEAR AND THE WITHHOLDING TAX (15%) WAS DEDUCTED UPON EACH DIVIDEND PAYMENT. SORRY IF THE WORDING WAS CONFUSING. 

THEY DON'T HAVE TO BE IN AN RRSP, IT JUST MAKES MORE SENSE TO HAVE THEM IN AN RRSP TO AVOID THE WITHHOLDING TAX YOU'D BE SUBJECTED TO IF THEY WERE IN A TFSA. 

HONESTLY THE QUESTION ABOUT WHICH BROKER HAS BEEN ONE THAT I'VE BEEN GRAPPLING WITH FOR THE BETTER PART OF A YEAR. FOR TFSA/RRSP, I FEEL RBC AND TD ARE BOTH SOLID BANKS. TD HAS PRETTY DECENT CUSTOMER SUPPORT AND YOU GAIN ACCESS TO THINK OR SWIM WHICH IS A GREAT SOLID CHARTING/TRADING PLATFORM. RBC AT LEAST OFFERS PAPER TRADING WHICH IS NICE. CIBC DOES NOT OR AT LEAST I HAVEN'T FOUND IT IF THEY DO IN TFSA/RRSP INVESTOR'S EDGE ACCOUNTS. THEY OFFER THE MOST COMPETITIVE COMMISSION RATES, BUT IF YOU DON'T PLAN ON PUTTING IN A LOT OF TRADES THEN THAT'S SOMEWHAT INCONSEQUENTIAL. THEIR FILLS ARE REALLY GOOD THOUGH, ALWAYS PRETTY CONTENT WITH THE SPEED AND PRICE AT WHICH THEY FILL ORDERS. HOWEVER, THEY'RE SHIT IN THE SENSE THAT THEY DON'T ALLOW STOPS AND LIMITS ON THE SAME EQUITY. FOR EXAMPLE, IF I WANT TOSS A STOP ON BNS @ $70 BUT ALSO PUT IN A LIMIT AT $75 I CAN'T HAVE BOTH OF THOSE ORDERS OPEN AT THE SAME TIME AS IT SAYS THE ""QUANTITY IS UNAVAILABLE"". CIBC'S UI IS ANTIQUATED AF. I DO MOST OF MY TRADING THROUGH IB OR TC2000 BUT I'D PERSONALLY SUGGEST TD BECAUSE FROM MY EXPERIENCE TOS IS ALSO VERY NICE. THERE ARE STIPULATIONS TO GETTING REAL-TIME DATA BUT THOSE ARE CLEARLY OUTLINED ON THEIR SITE :). 

UHHH BEST SOLUTION IS FIND AN EQUIVALENT ETF THAT'S HEDGED TO CAD. DEPENDING ON WHAT YOU'RE LOOKING TO BUY THERE MAY OR MAY NOT BE THAT. ",efoow1y,t3_amrutv,1549232375,1549257575.0,/r/CanadianInvestor/comments/amrutv/investment_in_us_listed_bond_and_dividend_etf/efoow1y/
51,ZivSerb,CanadianInvestor,"I CAN TELL YOU THAT CIBC CERTAINLY DOESN'T BECAUSE I WAS HOLDING AAPL FOR A LONG WHILE LAST YEAR AS WELL AS XLF AND BOTH WERE SUBJECTED TO WITHHOLDING TAXES. WHY IS IT TOUGH FOR QUESTRADE TO FLAG IT? WOULDN'T THE EQUITY BE HELD IN AN ACCOUNT CLASSIFIED AS A TFSA RATHER THAN RRSP? I WOULDN'T BANK ON OTHER BROKERS DOING THAT, SEEMS LIKE A SOLID WAY TO BE FLAGGED FOR TAX EVASION. ",efon7fy,t3_amrutv,1549231039,1549256239.0,/r/CanadianInvestor/comments/amrutv/investment_in_us_listed_bond_and_dividend_etf/efon7fy/
52,Thefailedbagel,CanadianInvestor,"1. I FOLLOW THE ADVICE BUT HAVE A SMALL ACTIVE PORTFOLIO FOR FUN (I MAJORED IN FINANCE AND FIND INVESTMENTS TO BE FASCINATING) 

2. ARROGANCE, BUT FOR ME THERE ARE A FEW THINGS:
A) I THINK IT WOULD BE INCREDIBLY STUPID TO BELIEVE I HAVE BETTER KNOWLEDGE ON MSFT, AAPL OR TD, RBC OVER INVESTMENT PROFESSIONALS. YET I DOUBT THE COMBINED PROFESSIONALS HAVE FOUND THE PERFECT PRICE FOR YOUR RANDOM CANADIAN STOCK ON THE TSX NO ONE OUTSIDE OF CANADA HAS EVER HEARD OF. 

B) I'M NOT DOING THIS FOR A LIVING, ONLY A FEW TRADES A YEAR ON STUFF I RESEARCHED AND TRULY BELIEVE IN MY ASSUMPTIONS/THESIS. MOST COMPANIES I HAVE BROUGHT ARE ONES I'M COMFORTABLE WITH BUYING AND HOLDING, MAYBE AT THE END I DON'T ""BEAT THE MARKET"" BUT A GAIN IS STILL A GAIN. 

C) THIS IS TOTALLY ON THE SIDE, I WAS PASSIVE UNTIL LAST YEAR BUT HAVE OUTPERFORMED THE MARKET. WITHOUT PUTTING SOME $$ WHERE MY MOUTH IS, I CAN NEVER SEE IF MY IDEAS ARE CORRECT OR NOT. MY BIGGEST FRUSTRATION IS EVEN IF I'M CURRENTLY BEATING THE MARKET, I HAVE NO IDEA IF THIS IS BLIND LUCK.  

3. INDEX AND HAVE AN ACTUAL DISCUSSION ABOUT THE RISK TOLERANCE THEY ARE COMFORTABLE WITH. ",eevagws,t3_ajej59,1548360126,1548385326.0,/r/CanadianInvestor/comments/ajej59/ask_ci_why_are_you_not_just_using_passive_index/eevagws/
53,ZivSerb,CanadianInvestor,"YES, BUYING FAANMG STOCKS AT THE TOP AND HOLDING WAS SUCH A SMART MOVE. ONLY THE SMARTEST INVESTORS BOUGHT AAPL AT $230 AND ARE STILL HOLDING HAHA. ",ee5y2f9,t3_agdq51,1547603124,1547628324.0,/r/CanadianInvestor/comments/agdq51/reits_in_2019/ee5y2f9/
54,throw0101a,CanadianInvestor,"&GT;  I KNOW NO ONE HAS A CRYSTAL BALL, BUT, WHAT DO YOU THINK THIS ETF’S POTENTIAL IS? $40 PER SHARE? $100 PER SHARE? OR IS THIS SOMETHING THAT IS MOSTLY HELD FOR THE SECURITY AND DIVIDEND? NOT SO MUCH SHARE GROWTH? MY TIMELINE IS 20+ YEARS. I’M 28.

THE PRICE OF A STOCK/ETF IN THE FUTURE IS IRRELEVANT: THE PRICE DIFFERENCE BETWEEN WHAT YOU BOUGHT AND SOLD IS IMPORTANT, PLUS PERHAPS DIVIDENDS (IF ANY).

AAPL IS CURRENTLY ABOUT US$150. I BOUGHT AAPL MANY YEARS AGO AT ABOUT $90, IT WENT UP TO $500 (MY RIMM DIDN'T DO AS WELL); I SOLD. IT WENT UP TO ABOUT $600, THEN THEY DID A 1:6 SPLIT AND IT ""WENT TO"" $100 AGAIN, RISING TO ITS CURRENT $150.

OF COURSE WHEN I HELD IT THERE WERE NO DIVIDENDS, AND THERE ARE NOW. SO EVEN IF A STOCK IS $X, AND IT STAYS AT $X FOR TEN YEARS, IF YOU'RE GETTING DIVIDENDS YOU CAN STILL MAKE MONEY FROM IT.

MANDATORY PROVISO ON SEEKING DIVIDENDS:

* HTTPS://CANADIANCOUCHPOTATO.COM/2011/01/18/DEBUNKING-DIVIDEND-MYTHS-PART-1/


AS FOR THE V-FUNDS SPECIFICALLY: THEY WILL DO WHAT THE INDEX WILL DO, BECAUSE THEY FOLLOW THE INDEX. IF VANGUARD THINKS THE PER-SHARE PRICE GETS TOO HIGHT, THEY MAY DO A SPLIT (THOUGH THAT WILL NOT EFFECT YOUR BOOK VALUE). HOW ETFS ARE ""MANUFACTURED"":

* HTTPS://WWW.YOUTUBE.COM/RESULTS?SEARCH_QUERY=HOW+ETFS+WORK
",edzu8uf,t3_afagah,1547407334,1547432534.0,/r/CanadianInvestor/comments/afagah/canadian_couch_potato/edzu8uf/
55,etienneclerc1997,CanadianInvestor,"THANK YOU FOR YOUR HELP, I'M HOLDING MY POSITIONS IN AAPL &AMP; V FOR THE TIME BEING AS I'M STILL CONFIDENT THAT'LL SEE SOME GREAT RETURNS AT SOME POINT, SO I'M MAINLY LOOKING FOR CAD ETFS! I LOOKED AT QUESTRADE A BIT TODAY, WILL LOOK DEEPER INTO THAT WHEN I GET SOME TIME, LOOKS LIKE IT COULD BENEFIT ME! WILL DEFINITELY CHECK OUT THAT LINK TOO!",edoytkt,t3_aecflb,1547100103,1547125303.0,/r/CanadianInvestor/comments/aecflb/is_this_a_good_plan/edoytkt/
56,etienneclerc1997,CanadianInvestor,"THANK YOU FOR THE ANSWER! ALSO NO, SORRY THAT MIGHT NOT HAVE BEEN SO CLEAR! I GOT 5K IN AN EMERGENCY FUND, AND THE REST IN AAPL &AMP; V, WISH IS ABOUT 3500$. I'M INVESTING EVERY MONTH AND ALSO INCREASING THE MONTHLY AMOUNT SO I SHOULD TECHNICALLY BE ABLE TO SAVE 100K IN THE NEXT 5 YEARS, WITH 50K OF THAT FOR A DOWN PAYMENT!",edoylxd,t3_aecflb,1547099855,1547125055.0,/r/CanadianInvestor/comments/aecflb/is_this_a_good_plan/edoylxd/
57,DistinctInvestor,CanadianInvestor,"I'M HOPING SOMEONE CAN CHIME IN ON ME, BUT IF YOU WANTED TO MOVE TO ETFS EXCLUSIVELY AND SELL OFF THE **AAPL** AND **V**, IT MIGHT BE BEST TO LEAVE THE MONEY IN USD BUY **VUN**. 

AS FOR CANADIAN ETFS, **XIC** / **VCN**, **XAW**, AND **ZAG** ARE THE LOW COST ONES TYPICALLY PROMOTED. 

AS SOMEONE ELSE MENTIONED, CONSIDER SWITCHING TO QUESTRADE SO YOU CAN BUY ETFS FOR FREE (OR ONLY PAY PENNIES ON ECN FEE). 

I SUGGEST GIVING THIS A READ: HTTPS://CANADIANCOUCHPOTATO.COM/MODEL-PORTFOLIOS/",edoy44z,t3_aecflb,1547099277,1547124477.0,/r/CanadianInvestor/comments/aecflb/is_this_a_good_plan/edoy44z/
58,mg_dividends,CanadianInvestor,"CURRENTLY LOOKING AT:
CANADA: BMO, RY, TD, BNS, FTS, BCE, T, CNR, ENB, CCO, CGX, 
US: JNJ, PEP, MMM, PFE, UTX, MO
TECH GROWTH: AAPL, NVDA, MU, AMZN (MAYBE), SHOP, MSFT, IBM
EMERGING MARKETS: KWEB (ETF THAT HOLDS STOCKS I LIKE IN CHINA)",edfs1wi,t3_adce1e,1546826124,1546851324.0,/r/CanadianInvestor/comments/adce1e/help_me_set_up_my_portfolio_22m/edfs1wi/
59,acre_,CanadianInvestor,"LITERALLY ONE DAY LEFT IN THE WEEK.

ALL IN ON AAPL.",ed6asz2,t3_ac9h0n,1546548108,1546573308.0,/r/CanadianInvestor/comments/ac9h0n/good_stocks_for_daytrades_this_week/ed6asz2/
60,mlitalien,CanadianInvestor,"I AM HOLDING AAPL, QCOM, INTC, AFL, WFC, KO, MCD, SBUX, TGT, JNJ, CVX, DIS AND BP",ed2qoik,t3_abm04x,1546434670,1546459870.0,/r/CanadianInvestor/comments/abm04x/us_dividend_stocks/ed2qoik/
61,Shaun8030,CanadianInvestor,"GOOG , AMZN , APPLE , MSFT , DISNEY , VISA , BAM",fclcmx7,t3_ehsi9b,1577744729,1577769929.0,/r/CanadianInvestor/comments/ehsi9b/what_are_the_best_10_stocks_to_buy_now_and_hold/fclcmx7/
62,John__47,CanadianInvestor,"THANKS FOR SHARING YOUR THOUGHTS --- HAVE BEEN READING SOME OF YOUR POSTS ON THE SUBJECT IN DIFFERENT THREADS. AM LOOKING FOR INVESTMENTS FOR A FAMILY MEMBER WHO WANTS RECOMMENDATIONS FOR ESG/SRI. THE BROAD CANADIAN MARKET PRODUCTS THAT APPLY FILTERS STILL TEND TO HAVE ENERGY COMPANIES (ENBRIDGE, SUNCOR) THAT , BUT THEY'RE STILL BETTER THAN NOTHING. IF YOU GO FOR THE US MARKET, THEN THE TOP HOLDINGS ARE APPLE, GOOGLE, FACEBOOK, SO I GUESS THAT'S BETTER.

&AMP;#X200B;

I'M WONDERING --- YOU WRITE THAT YOU LIKE ESGV AND VSGX.

FOR SOMEONE WHO HAS ONLY $5000 TO INVEST, XSUS WOULD COME OUT TO BASICALLY THE SAME AS VSGV, RIGHT?

THE DIFFERENCE IN MER --- 0.12% FOR THE VANGUARD USD PRODUCT VS 0.28% FOR THE ISHARES $C PRODUCT ---- IS 0.16%, WHICH COMES OUT TO JUST $8 PER YEAR FOR A $5000 INVESTMENT.

&AMP;#X200B;

THE FILTERS APPLIED SEEM TO LEAVE THE SAME BIG COMPANIES.",fc6oncp,t3_e5a7tt,1577485600,1577510800.0,/r/CanadianInvestor/comments/e5a7tt/2020_sector_plays/fc6oncp/
63,landoonter,CanadianInvestor,"LOOK AT THE UNBELIEVABLE INNOVATION &AMP; PROGRESS AMERICA HAS MADE IN THE LAST DECADE. COMPANIES LIKE TESLA, SPACE X, APPLE, GOOGLE, AMAZON ECT REDEFINING ENTIRE INDUSTRIES. A BET AGAINST AMERICA IS A LOOSING BET IN MY OPINION...",fc18mbk,t3_efb25u,1577311383,1577336583.0,/r/CanadianInvestor/comments/efb25u/any_personal_financeinvesting_book_recommendations/fc18mbk/
64,DrTuttlebaum,CanadianInvestor,VISA APPLE MICROSOFT JPM MASTERCARD,fc0ur8f,t3_eem0q0,1577300157,1577325357.0,/r/CanadianInvestor/comments/eem0q0/which_stocks_do_you_own_that_have_been_doing_well/fc0ur8f/
65,Shaun8030,CanadianInvestor,"MSFT , APPLE , GOOGLE , DISNEY VISA , MASTERCARD , BAM , SHOPIFY",fb67d7x,t3_ebo0hs,1576543218,1576568418.0,/r/CanadianInvestor/comments/ebo0hs/share_your_tfsa_portfolio/fb67d7x/
66,Shaun8030,CanadianInvestor,"APPLE , MSFT , GOOGLE , DISNEY , VISA , MA FOR NEXT 30 YEARS",fb65cit,t3_ebgngo,1576541776,1576566976.0,/r/CanadianInvestor/comments/ebgngo/2020_picks/fb65cit/
67,LuxGang,CanadianInvestor,"LOW COST AND GLOBALLY DIVERSIFIED. XAW IS UP 18% YTD AND XIC IS UP 21% YTD, WHICH IS INCREDIBLE WHEN YOU CONSIDER MARKETS GENERALLY AVERAGE 7% PER YEAR.

OBVIOUSLY GOING 100% S&AMP;P500 OR PICKING THE RIGHT STOCKS WOULD HAVE DONE MUCH BETTER, BUT THERE'S NO GUARANTEE THE US OR SPECIFIC STOCKS (LIKE APPLE OR MSFT) CONTINUE TO OUTPERFORM THE REST OF THE WORLD IN THE COMING DECADES.",fb5ib3j,t3_ebgngo,1576528165,1576553365.0,/r/CanadianInvestor/comments/ebgngo/2020_picks/fb5ib3j/
68,whatyoulookinatbud,CanadianInvestor,"I PUT A STOP LOSS ON APPLE @ $220 RIGHT BEFORE IT BOUNCED AND SKYROCKETED :(

BOUGHT AT $200 :( :( :(

ALSO TSLA AFTER ITS BIG EARNINGS. I HAD A FEELING IT WOULD HAVE A HUGE SHORT SQUEEZE, HINDSIGHT 20/20",fb4hs5g,t3_ebg5di,1576509223,1576534423.0,/r/CanadianInvestor/comments/ebg5di/top_regrets_2019_what_are_some_buying_or_selling/fb4hs5g/
69,SUPRVLLAN,CanadianInvestor,"“COMPRISING 23.84% OF THE BERKSHIRE HATHAWAY PORTFOLIO, APPLE INC. (AAPL) REPRESENTS BUFFETT'S LARGEST HOLDING, WITH A WHOPPING 249 MILLION SHARES IN THE TECH GIANT, AS OF NOVEMBER 2019. CURRENTLY WORTH APPROXIMATELY $65 BILLION, IN 2018, APPLE SURPASSED WELLS FARGO TO CAPTURE THE #1 SPOT AFTER BERKSHIRE HATHAWAY PURCHASED ADDITIONAL SHARES OF THE STEVE JOBS-FOUNDED COMPANY IN FEBRUARY OF THAT YEAR.”

HTTPS://WWW.INVESTOPEDIA.COM/ARTICLES/INVESTING/022816/TOP-5-POSITIONS-WARREN-BUFFETTS-PORTFOLIO.ASP",favced9,t3_eannpj,1576357620,1576382820.0,/r/CanadianInvestor/comments/eannpj/what_would_you_consider_as_a_high_portfolio/favced9/
70,randomguy506,CanadianInvestor,APPLE DOES NOT REPRESENT 25% OF BUFFET'S PORTFOLIO.,fauvzsl,t3_eannpj,1576353311,1576378511.0,/r/CanadianInvestor/comments/eannpj/what_would_you_consider_as_a_high_portfolio/fauvzsl/
71,randomguy506,CanadianInvestor,HOW CAN APPLE REPRESENT 25% OF BUFFET'S PORTFOLIO WHEN BERKSHIRE HAS OVER $700B?,faiz9jp,t3_e9hme1,1576120235,1576145435.0,/r/CanadianInvestor/comments/e9hme1/a_detailed_breakdown_of_warren_buffets_portfolio/faiz9jp/
72,Hologram0110,CanadianInvestor,"PAST PERFORMANCE DOESN'T GUARANTEE FUTURE PERFORMANCE AND HINDSIGHT IS ALWAYS 20-20. BY THE SAME LOGIC  YOU COULD HAVE PUT ALL YOUR MONEY IN APPLE, GOOGLE, SHOP, MICROSOFT ETC AND BEATEN INDEXES. 

THERE IS A HUGE AMOUNT OF POLITICAL RISK IN THE US. CHANGES TO TAX CODES, MANAGEMENT STRUCTURES, TRADE RULES, COULD ALL BE A DRAG ON AMERICAN COMPANIES. 

MORE RISK CAN MEAN MORE REWARD, BUT IT IS FAR FROM CERTAIN.",faa2w24,t3_e861tv,1575900702,1575925902.0,/r/CanadianInvestor/comments/e861tv/100_sp500_am_i_crazy/faa2w24/
73,Shaun8030,CanadianInvestor,"NOTHING CANADIAN WILL SOAR IMO BUT APPLE AND CHIP MAKERS , NVIDIA , QUALCOMM , BROADCOM , INTEL , MICRON, AMD WILL BENEFIT TREMENDOUSLY. JUST BUY VGT AND YOU GET THEM ALL IN A NICE LOW COST PACKAGE WITH A 1.5 PERCENT DIVIDEND TOO.",fa17z1t,t3_e7kk3w,1575765973,1575791173.0,/r/CanadianInvestor/comments/e7kk3w/if_uschina_trade_deal_gets_signed_which_canadian/fa17z1t/
74,NegativePapaya1,CanadianInvestor,"I WILL BE AROUND 15$, BOUGHT APPLE TWICE IN JANUARY. OTHER THAN THAT ALL ETFS WHICH ARE FREE ON QUESTRADE",f9xx66n,t3_e75vgc,1575719787,1575744987.0,/r/CanadianInvestor/comments/e75vgc/how_much_in_trade_fees_do_you_typically_pay_in_a/f9xx66n/
75,BCRE8TVE,CanadianInvestor,"IF YOU GIVE 1 PERSON 10 APPLES AND 9 PEOPLE 0 APPLES, THE AVERAGE PERSON RECEIVES 1 APPLE.

THE AVERAGE CAN BE VERY MISLEADING IF THAT'S THE ONLY FIGURE YOU'VE GOT. REALLY, TWO MUCH MORE TELLING NUMBERS WOULD BE THE MEDIAN (THE 2ND QUARTILE, OR 50TH PERCENTILE) AND THE MODE (THE NUMBER THAT COMES UP MOST OFTEN). IN THE ABOVE 10 APPLES TO 1 PERSON EXAMPLE, THE AVERAGE IS 1 PER PERSON, BUT THE MODE AND MEDIAN WOULD BE 0.

SO YEAH, IF ONE SECTOR OF JOBS IS PAYING TREMENDOUSLY MORE, IT'S PULLING UP THE AVERAGE, BUT IT'S DOING ABSOLUTELY NOTHING FOR ANYONE OUTSIDE OF THAT ONE SECTOR. THE AVERAGE GOING UP MEANS VERY LITTLE IF YOU DON'T HAVE THE MODE AND MEDIAN.",f9wiyah,t3_e70w7b,1575693388,1575718588.0,/r/CanadianInvestor/comments/e70w7b/canada_posts_largest_job_loss_since_2009_on/f9wiyah/
76,svanegmond,CanadianInvestor,"THERE IS LITERALLY NO HARM TO REALIZING GAINS IN AN RSP OR TFSA AND TRADING OVER TO A PORTFOLIO THAT YOU THINK MORE SUITED FOR THE TIMES.  
TRADING COSTS ASIDE WHY THE HELL NOT?
I AM LOOKING AT HIGH PE STOCKS ON MY HOLDINGS LIKE INTUIT -  43 AND APPLE - 22 AND YOU CAN BE SURE THEY HAVE LONG DATED SELL ORDERS OPEN FOR THEM.
THEY ARE GOOD BUYS AT A LOWER PRICE.",f924y5v,t3_e3b1t0,1575012802,1575038002.0,/r/CanadianInvestor/comments/e3b1t0/realizing_gains/f924y5v/
77,n0tfakenews,CanadianInvestor,"RIGHT - SEDAR IS ONLY FOR CANADIAN COMPANIES, SO THAT'S WHY YOU DIDN'T FIND ANYTHING ON APPLE

YOU CAN SEARCH AROUND HERE FOR STARTERS:

HTTPS://INVESTOR.APPLE.COM/INVESTOR-RELATIONS/DEFAULT.ASPX",f89wg5l,t3_dzriwy,1574381606,1574406806.0,/r/CanadianInvestor/comments/dzriwy/what_do_you_wish_you_knew_before_you_started/f89wg5l/
78,BO-DACIOUS55,CanadianInvestor,I JUST SEARCHED THE BEST STOCK I'M FOLLOWING APPLE. I'LL TRY DOING THAT NEXT.,f89wbre,t3_dzriwy,1574381515,1574406715.0,/r/CanadianInvestor/comments/dzriwy/what_do_you_wish_you_knew_before_you_started/f89wbre/
79,NegativePapaya1,CanadianInvestor,"I BEAT THE MARKET THIS YEAR, BUT RARELY DO I TRY TO ""BEAT"" THE MARKET. I PURCHASED FAANG STOCKS (MAINLY APPLE) IN JANUARY. 

I JUST GOT LUCKY, BUT THERE WAS SO MUCH BAD NEWS THAT DROVE THOSE STOCKS DOWN (THE ENTIRE MARKET), AND I REMEMBER LOOKING AT APPLE AT 156.50 BEING LIKE WHY NOT.  AGAIN, GOT LUCKY AND PROBABLY WON'T DO IT AGAIN FOR SOME TIME.",f85zdxn,t3_dz7u6d,1574286533,1574311733.0,/r/CanadianInvestor/comments/dz7u6d/have_you_ever_beat_the_market_how/f85zdxn/
80,svanegmond,CanadianInvestor,"US TECH, YOU CAN DO INDIVIDUAL NAMES SUCH APPLE OR AMAZON... WHOEVER GETS YOUR MONEY OUTSIDE OF INVESTING... OR MORE ACTIVE ETF LIKE ARK, ARKW. OR YOLO MATERIAL SUCH AS TQQQ WHICH IS LEVERAGED RETURNS OF THE INDEX",f7yayds,t3_dxykxx,1574091003,1574116203.0,/r/CanadianInvestor/comments/dxykxx/what_do_you_think_about_my_portfolio/f7yayds/
81,MushroomCake28,CanadianInvestor,"WHY ONLY CANADIAN STOCKS? I UNDERSTAND WEALTHSIMPLE TRADE IS NICE WITH THEIR NO FEE WITH CANADIAN STOCKS, BUT NOTHING IS PREVENTING YOU FROM HAVING 2 BROKERS (THAT'S WHAT I DO, QT FOR US STOCKS AND WST FOR CANADIAN STOCKS). ADD SOME US POSITIONS.

AS FOR YOUR CANADIAN STOCK CHOICES, YOU FOUND SOME GOOD ONES. BUT FOR YOUR FINANCE SECTOR, BMO AND CM SHOULD HAVE SMALLER POSITIONS AND TD AND RY SHOULD BE YOUR BIGGEST POSITIONS. I MYSELF GO FOR 40% TD, 40% RY, 20% BNS. YOU HAVE TO LOOK FOR DIVIDEND GROWTH OVER YEARS, NOT JUST DIVIDEND YIELD. TD AND RY HAVE THE GREATEST HISTORIC DIVIDEND GROWTH FROM ALL OF THE BANKS, FOLLOWED BY BNS. 

AS FOR UTILITIES STOCK (WHICH YOU SEEM TO PUT WITH THE ENERGY STOCK), YOU'RE MISSING THE BEST 2 (IMHO): FTS AND ACO-X (ACO-X ACTUALLY HOLDS 52% OF CU STOCKS, SO YOU'RE KIND OF EXPOSED TO IT, BUT ACO-X HAS BETTER DIVIDEND GROWTH THAN CU, BUT WITH A SLIGHTLY LOWER DIVIDEND YIELD CURRENTLY).

YOU'RE SERIOUSLY TOO UNDERWEIGHT IN THE TECH SECTOR AND TOO OVERWEIGHT IN THE REAL ESTATE SECTOR. FOR TECH, GO WITH US COMPANIES, THERE ARE SO MANY GOOD ONES. THERE ARE THE FAMOUS ONES LIKE GOOGLE, FACEBOOK, APPLE, MICROSOFT, ETC. AS FOR REAL-ESTATE, I KNOW THEY HAVE HIGH YIELDS AND MONTHLY PAYMENTS, BUT THEY ARE BY FAR THE SECTOR WITH THE SLOWEST DIVIDEND GROWTH. 

PERSONALLY I FIND THE MARKET VERY OVERPRICED CURRENTLY, SO I WOULD WAIT FOR A LITTLE PULLBACK TO ENTER THE MARKET, BUT IT'S REALLY A CASE BY CASE THING. SOME STOCKS CAN BE UNDERVALUED (LIKE THE ENERGY SECTOR IN CANADA, BUT NOT ALL THOSE IN YOUR LIST SINCE SOME OF THEM BELONG IN THE UTILITY SECTOR, WHICH IS OVERPRICED CURRENTLY), OTHERS ARE FAIRLY VALUED (CANADIAN BANK STOCKS), AND SOME ARE CLEARLY OVERVALUED (TECH STOCKS IN THE US). IF YOU'RE WORRIED ABOUT YOUR ENTRY POINT, I WOULD SUGGEST DOING THE COST AVERAGE STRATEGY, MEANING BUYING THE SAME AMOUNT OF MONEY WORTH OF STOCKS AT A SET INTERVAL (LIKE EVERY MONTH FOR EXAMPLE). THAT WAY, YOU'LL BUY INTO THE HIGHS AND THE LOWS, AVERAGING YOUR COST ON THE LOW SIDE (SINCE WITH THE SAME AMOUNT OF MONEY YOU'LL BE ABLE TO BUY MORE LOW PRICE STOCKS AND LESS HIGH PRICE STOCKS).",f7xgv6a,t3_dxykxx,1574057072,1574082272.0,/r/CanadianInvestor/comments/dxykxx/what_do_you_think_about_my_portfolio/f7xgv6a/
82,HGTV-Addict,CanadianInvestor,"THIS WAS ME BACK IN MAY 2018. I AVERAGED IN VFV OVER 12 MONTHS, STARTING AT AN ATH. SOME REGRET AS IT TICKED UP, BUT THEN I BOUGHT IN 50% AT ONCE IN DECEMBER 30TH 2018 AND GOT A MUCH BETTER PRICE. THE DIFFERENCE TODAY IS 10% GAIN VS 22%. 

APPLE IS ANOTHER ONE AS I LOOK BACK THROUGH THE HISTORY. IT RANGES FROM 40% UP TO 80% FOR AN EQUAL-SIZED BUY ON DECEMBER 24TH. 

TENCENT, FIRST BUY IS 12% DOWN, LAST ONE IS 30% UP. 

VOO IS INTERESTING. BASICALLY ALL BUYS BAR JUNE THIS YEAR ARE AT 12% UP, SOMEHOW. SEEM TO KEEP HITTING THE SAME BUY PRICE.",f7xcned,t3_dxy2h6,1574052775,1574077975.0,/r/CanadianInvestor/comments/dxy2h6/buying_sp500_etf_vfv_at_aths/f7xcned/
83,Shaun8030,CanadianInvestor,"LONG TERM ... APPLE , GOOGLE , DISNEY MICROSOFT , AMZN, BAM, VISA . APPLE AND DISNEY SUBSCRIPTION SERVICES. AMZN AND MICROSOFT CLOUD COMPUTING. GOOGLE SOFTWARE HARDWARE AI LEADER . VISA FINTECH LEADER FOR FORSEEABLE FUTURE. BAM ONLY GOOD CANADIAN STOCK (MAYBE SHOP BUT IT SEEMS OVERPRICED ).",f7kmio5,t3_dwpk7n,1573818174,1573843374.0,/r/CanadianInvestor/comments/dwpk7n/what_growth_or_dividends_stocks_would_you_buy/f7kmio5/
84,Shaun8030,CanadianInvestor,"FORGET GOOS ....APPLE, DISNEY AND BAM ARE SOARING  RIGHT NOW LOVE IT.",f7fyzf2,t3_dvst7i,1573690246,1573715446.0,/r/CanadianInvestor/comments/dvst7i/thoughts_on_goos/f7fyzf2/
85,luislovesmoney,CanadianInvestor,"IN THE YEARS TO COME IS THE GREAT BANKING DISRUPTION. WHY WOULD I USE A TRADITIONAL BANK WHEN I CAN GET ONE THAT GIVES ME THE SAME SERVICES FOR FREE? HOW CAN THEY COMPETE WITH APPLE, PAYPAL, SQUARE AND OTHERS STARTING TO ROLL OUT DIGITAL WALLETS?",f7ejzwq,t3_dvtdf0,1573659378,1573684578.0,/r/CanadianInvestor/comments/dvtdf0/the_future_of_canadian_banks/f7ejzwq/
86,jugwhatever,CanadianInvestor,"CAN WE POST OUR FAILURES TOO? MINE IS ABOUT $55,000. LOST A LOT BEING AN IDIOT BY SELLING APPLE AND GOOGLE TO INVEST IN JUNIOR MINING COMPANIES (AKA GARBAGE) IN THE AFTERMATH OF THE FINANCIAL CRISIS. THEN SOLD IT ALL IN FRUSTRATION AND SAT OUT THE LONGEST BULL RUN IN HISTORY. ONLY HAVE BEEN BACK INVESTING FOR THE PAST 2 YEARS.",f7e78ks,t3_dvn35o,1573649205,1573674405.0,/r/CanadianInvestor/comments/dvn35o/who_has_accumulated_the_highest_tfsa_balance/f7e78ks/
87,jugwhatever,CanadianInvestor,"IT’S NOT AS COMPLICATED AS IT SOUNDS. BEP IS SPLITTING INTO TWO, AND YOU’LL END UP OWNING SOME OF EACH PIECE. IT’S LIKE IF YOU HAD AN APPLE AND THEY CUT IT IN HALF. YOU STILL OWN THE SAME STUFF, IT’S JUST IN TWO SMALLER PIECES NOW. ALSO ONE HALF OF THE APPLE PAYS NORMAL DIVIDENDS THAT ARE ELIGIBLE FOR THE DIVIDEND TAX CREDIT, AND THE OTHER HALF PAYS A WEIRD MIX OF INTEREST, RETURN OF CAPITAL, ETC. BUT YOUR TOTAL $$$ BEFORE TAX IS THE SAME. 

IN YOUR TSFA IT WON’T MATTER MUCH. THE REGULAR DIVIDEND MAY BE SLIGHTLY BETTER IF IT ISN’T SUBJECT TO US WITHHOLDING TAX, BUT WE’RE TALKING LESS THAN A PERCENT DIFFERENCE.",f79pvei,t3_durtlg,1573512623,1573537823.0,/r/CanadianInvestor/comments/durtlg/bep_announces_unit_split_creation_of_an_exchange/f79pvei/
