,author,subreddit,body,id,link_id,created_utc,created,permalink
0,attirer,CanadianInvestor,"I HAVEN’T BEEN TRACKING STOCKS VS ETFS BUT IT’S PROBABLY A MIXED BAG. I HAVE SOME WINNERS I’M STILL HOLDING (SEDG, BAM.A), SOME I TRADED AT THE RIGHT TIME (BZUN, NVEE, TPIC) OR TOO SOON (SHOP, PAYC, V, AAPL), AND SOME I SHOULD NEVER HAVE BOUGHT (SUPV, YRD).

MY OVERALL RETURNS HAVE BEEN SLIGHTLY ABOVE WHAT YOU COULD EXPECT FROM JUST HOLDING VGRO SO IT’S MOSTLY BEEN OPPORTUNITY COSTS — MONEY COULD HAVE BEEN INVESTED IN BROAD-MARKET ETFS FOR SIMILAR RETURNS, AND I COULD HAVE USED THE HUNDREDS OF HOURS SPENT DOING RESEARCH AND TRADING ON SOMETHING MORE PRODUCTIVE.",fcm5kg1,t3_ehrozi,1577764807,1577790007.0,/r/CanadianInvestor/comments/ehrozi/beginning_investor_2019/fcm5kg1/
1,imgram,CanadianInvestor,"GOING TO GO AGAINST THE GRAIN OF THE RETAIL INVESTING CONSENSUS AND SAY RIDESHARING. 

I LIKE TO PICK SOME SECURITIES WHERE I BELIEVE THE MARKET THESIS IS INCORRECT. FOR INSTANCE, WHEN AAPL DEVALUED LAST YEAR BECAUSE PEOPLE WERE CONCERNED ABOUT DECLINING UNIT SALES BUT IGNORING THE LIFETIME VALUE OF THE CUSTOMER THAT COMES WITH SERVICES AND WEARABLES.

THE GENERAL CONSENSUS AMONG A LOT OF INVESTORS SEEMS TO BE THAT RIDESHARING (LYFT/UBER) IS LOSING BILLIONS OF DOLLARS AND HAVE NO PATH TO PROFITABILITY. WHERE I THINK PEOPLE ARE UNDERESTIMATING THE TWO COMPANIES IS THE ELEVATED SHARE-BASED COMPENSATION THAT OCCURS WITH ANY IPO. DEPENDING ON HOW YOU WANT TO ADJUST OR NORMALIZE FOR THAT, I'D PEG THE BUSINESSES AT ROUGHLY A -25% OPERATING MARGIN WHICH ADMITTEDLY IS PRETTY BAD. HOWEVER, WITH TAKE-RATES IN THE ~20-25% RANGE, IF THEY ARE ABLE TO INCREASE PRICES BY ~5% (EITHER THROUGH HIGH PRICES/LOWER PROMOTIONS), THIS GETS THEM TO ROUGHLY BREAK-EVEN WHEN ELEVATED NEAR-TERM SBC IS ADJUSTED FOR. 

WHETHER THIS OCCURS OR NOT IS ANYONE'S GUESS BUT IF THE COMPANIES ADOPT A PRICE LEADER, PRICE FOLLOWER DYNAMIC, THE ROAD TO PROFITABILITY WILL BE CLEAR BY THE END OF 2020 AND I THINK THE SHARES WILL RE-RATE UP. AS FAR AS I CAN TELL, MANAGEMENT SEEMS TO BE SIGNALLING THAT PROFITABILITY IS IMPORTANT BUT THE MARKET IS LARGELY UNCONVINCED RIGHT NOW. IF YOU VIEW THE MARKET DYNAMICS OF RIDE SHARE THROUGH THE LENS OF THE RULE OF 3, BOTH UBER AND LYFT BENEFIT FROM NO LONGER TRYING TO CAPTURE MORE MARKET SHARE BUT STARTING TO RATIONALIZE PRICING.",fb70o8i,t3_ebgngo,1576568001,1576593201.0,/r/CanadianInvestor/comments/ebgngo/2020_picks/fb70o8i/
2,wolfie55,CanadianInvestor,"IT'S A WEIRD COMBINATION BUT ORIGINALLY XAW WAS TO COUNTER-BALANCE MY BASICALLY 2 STOCK PORTFOLIO (AAPL, BRK.B).  WHEN I SOLD THEM I BOUGHT ZSP.   I DON'T LIKE THE COUNTRY PERCENTAGES OF SOME OF THE INTERNATIONAL ETFS, BUT THE US PORTION OF 50%+ IN XAW MAKES MORE ME COMFORTABLE AND I HAVE SOME INT. DIVERSIFICATION",faxxfz1,t3_eapeoj,1576391557,1576416757.0,/r/CanadianInvestor/comments/eapeoj/i_hold_cdn_blue_chips_and_a_sp500_etf_what_should/faxxfz1/
3,angelus97,CanadianInvestor,"YOU NEED SOME US TECH. GOOG, AAPL, AMZN, FB, MSFT.",favftv6,t3_eapeoj,1576358432,1576383632.0,/r/CanadianInvestor/comments/eapeoj/i_hold_cdn_blue_chips_and_a_sp500_etf_what_should/favftv6/
4,SUPRVLLAN,CanadianInvestor,"“COMPRISING 23.84% OF THE BERKSHIRE HATHAWAY PORTFOLIO, APPLE INC. (AAPL) REPRESENTS BUFFETT'S LARGEST HOLDING, WITH A WHOPPING 249 MILLION SHARES IN THE TECH GIANT, AS OF NOVEMBER 2019. CURRENTLY WORTH APPROXIMATELY $65 BILLION, IN 2018, APPLE SURPASSED WELLS FARGO TO CAPTURE THE #1 SPOT AFTER BERKSHIRE HATHAWAY PURCHASED ADDITIONAL SHARES OF THE STEVE JOBS-FOUNDED COMPANY IN FEBRUARY OF THAT YEAR.”

HTTPS://WWW.INVESTOPEDIA.COM/ARTICLES/INVESTING/022816/TOP-5-POSITIONS-WARREN-BUFFETTS-PORTFOLIO.ASP",favced9,t3_eannpj,1576357620,1576382820.0,/r/CanadianInvestor/comments/eannpj/what_would_you_consider_as_a_high_portfolio/favced9/
5,Craigk911,CanadianInvestor,"CANADIAN BANKS, US TECH (AAPL, AMZN), AND ANYTHING ELSE I COULD GET MY HANDS ON. BUT HINDSIGHT IS 20/20. BETTER QUESTION IS WHAT DO YOU BUY DURING THE NEXT RECESSION AND WHY",facoj2c,t3_e84o0f,1575943610,1575968810.0,/r/CanadianInvestor/comments/e84o0f/time_travel_back_to_the_2008/facoj2c/
6,ba5icsp00k,CanadianInvestor,THESE PAST 5 YEARS I PUT ALL MY MONEY IN MEME STOCKS LIKE AAPL AMZN MSFT TD RY V BABA ETFS LIKE VUN VFV XRE AND EVEN MORE BORING STOCKS LIKE ENB AND BCE AND I’VE MADE AN ABSOLUTE KILLING. YOU ARE AN IT GENIUS WHAT MADE YOU THINK YOU WERE A DAY TRADER?,f96z47e,t3_e4369z,1575155456,1575180656.0,/r/CanadianInvestor/comments/e4369z/lost_over_50_of_stock_portfolio_in_1_month_need/f96z47e/
7,DividendEarner,CanadianInvestor,"BANKS ARE THE LEAST PERFORMING STOCKS IN MY PORTFOLIO. YES THEY ARE STABLE, HAVE SOME GROWTH AND A DECENT YIELD BUT THAT’S NOT WHAT POWERS MY RATE OF RETURN.

US STOCKS LIKE V, MA, COST, MSFT AND AAPL HAVE BY OUTPERFORM THE BANKS AND THEY ARE ALL BIGGER THAN OUR BANKS.

ATD.B IS ONE EXAMPLE ON THE CANADIAN SIDE.

MY PORTFOLIO IS HERE: HTTPS://WWW.DIVIDENDEARNER.COM/DIVIDEND-STOCKS-PORTFOLIO/

YOU JUST NEED TO GET OVER THE EXCHANGE RATE CONCEPT.",f8yqwyf,t3_e1oa1s,1574951558,1574976758.0,/r/CanadianInvestor/comments/e1oa1s/canadian_banks_are_about_to_report_their_slowest/f8yqwyf/
8,hokageace,CanadianInvestor,"I WILL START BY SAYING YOU SHOULD NOT MAKE SERIOUS INVESTMENT DECISIONS BASED ON ADVICE GIVEN BY STRANGERS ONLINE.

THAT SAID...

THIS IS NOT AN INSIGNIFICANT AMOUNT OF MONEY, HOW MUCH DO YOU KNOW ABOUT INVESTMENTS? IF NOT MUCH THEN VERY IMPRESSIVE BECAUSE YOU COULD DO A LOT WORSE. 

YOU SHOULD TALK TO SOME FINANCIAL ADVISORS AS YOU ARE CLOSE TO THE FUNDS THEY TAKE ON IF YOU DON'T KNOW MUCH ABOUT INVESTING. I AM TALKING ABOUT THOSE WHO CAN PROVIDE ADVICE ON INDIVIDUAL STOCKS AND NOT YOUR AVERAGE BANK ONE WHICH CAN ONLY SELL YOU MUTUAL FUNDS. IF YOU GO THIS ROUTE, WATCH OUT FOR FEES AS I DON'T THINK ANYTHING HIGHER THAN 1-1.2% IS WORTH IT.

IF YOU STILL WANT TO GO AT IT INDIVIDUALLY....STUDY AND EDUCATE YOURSELF BUT HERE ARE SOME THINGS TO KEEP IN MIND.

FIRST IS POSITION SIZING. CONVENTIONAL WISDOM SAYS YOU SHOULD NOT HAVE MORE THAN 7% IN AN INDIVIDUAL STOCK TO REDUCE SINGLE STOCK RISK UNLESS YOU ARE A PRO. ETFS DO NOT COUNT. I WOULD DEFINATELY REDUCE TD SIGNIFICANTLY AND ALL OTHERS TO 7% OR 10% AT MOST.

VFV IS A VERY GOOD ETF AND YOU WOULD NOT GO WRONG IF IT'S 100% OF YOUR PORTFOLIO. YOU WOULD PROBABLY OUTPERFORM MOST ADVISORS WITH JUST THAT. HOWEVER, YOU SHOULD LOOK AT GETTING THE US VERSION LISTED ON A US EXCHANGE IN USD. I BELIEVE USD IS A BETTER CURRENCY LONG TERM (LOOK UP NORBERT'S GAMBIT FOR EXCHANGE) AND IF YOU HOLD IT IN AN A NON-REGISTERED ACCOUNT OR TFSA, THERE ARE TAX IMPACTS ON CANADIAN LISTED ONES. I WOULD ALSO PICK VTI BECAUSE IT'S ALL MARKET AND VFV IS ABOUT 80% OF MARKET AND DOES NOT HAVE SMALLER COMPANIES WHICH HISTORICALLY OUTPERFORM.

I WOULD GET RID OF THE BOND INDEX SIMPLY DUE TO YOUR TIME HORIZON. I WOULD SAY START TO THINK ABOUT BONDS AT 10 YEARS FROM RETIREMENT OR WHEN YOU NEED TO ACCESS THE FUNDS.

I WOULD GET RID OF THE BAM SUB AND JUST KEEP BAM. IT IS A SUPERIOR INVESTMENT.

REST OF STOCKS ARE GREAT. I WOULD LOOK AT AQN AND ATD.B AS WELL IN CANADA. GREAT CHOICE WITH NOT GETTING A CANADIAN ETF BECAUSE THEY ARE FULL OF GARBAGE IN ENERGY AND NATURAL RESOURCES.

IF YOU WANT MORE INDIVIDUAL STOCKS, I WOULD LOOK AT US LARGE CAP TECH LIKE MSFT, V AND AAPL. RELATIVELY SAFE AND HAVE MORE GROWTH.",f8vbal0,t3_dzuin1,1574865127,1574890327.0,/r/CanadianInvestor/comments/dzuin1/what_do_you_guys_think_about_my_portfolio/f8vbal0/
9,Lx-nt,CanadianInvestor,"LEAPS+ AAPL+ V+MSFT+COST

 = 200-600% GAINZ PER YEAR LOL",f86zwxd,t3_dz7u6d,1574311410,1574336610.0,/r/CanadianInvestor/comments/dz7u6d/have_you_ever_beat_the_market_how/f86zwxd/
10,fhuckatron5000,CanadianInvestor,THANKS TO MY BOY TIM COOK AND AAPL.,f86okob,t3_dz7u6d,1574303198,1574328398.0,/r/CanadianInvestor/comments/dz7u6d/have_you_ever_beat_the_market_how/f86okob/
11,CompletePaper,CanadianInvestor,GOT IN TSLA AT 194 AND AAPL AT 174. EVERY YEAR I'LL USUALLY PICK MAYBE A HANDFUL OF STOCKS WHEN I THINK THEY'RE AT A GOOD PRICE. I USUALLY KEEP THAT ACCOUNT SEPERATE TO JUST MESS AROUND WITH. MY OTHER ACCOUNTS ARE ALL BORING ETFS. YOU JUST NEED TO BE OKAY WITH THE RISK. I GOT PRETTY LUCKY WITH A LOT OF SWING TRADES TRYING TO TAKE ADVANTAGE OF THE TRADE WAR THROUGH TQQQ AND TVIX ALSO. I MADE IT OUT ALRIGHT BUT I REALISED I WAS OUTSIDE OF MY COMFORT ZONE WITH THE RISK. IT WAS HONESTLY JUST GAMBLING AND I WOULDN'T ACTUALLY ADVISE ANYONE TO DO THE SAME THING BUT YOU ASKED IF I'VE EVER BEAT THE MARKET SO HERE WE ARE HAHA.,f86nz7h,t3_dz7u6d,1574302809,1574328009.0,/r/CanadianInvestor/comments/dz7u6d/have_you_ever_beat_the_market_how/f86nz7h/
12,marketgodfather,CanadianInvestor,I BEAT THE MARKET EVERY YEAR WIT OPTIONS AND AAPL.,f86l4zk,t3_dz7u6d,1574300893,1574326093.0,/r/CanadianInvestor/comments/dz7u6d/have_you_ever_beat_the_market_how/f86l4zk/
13,wolfie55,CanadianInvestor,"BASICALLY DUE TO LUCK, MY 6 YEAR COMPOUND RETURN IS JUST A SMIDGE OVER 16% IN MY RRSP (NOT SO LUCK IN MY NON-REG &AMP; TFSA).  

WHY ?  LARGE CONCENTRATION IN AAPL AND BRK.B.   I ALSO HELD VOO &AMP; VXUS.

I DID SELL OFF LAST YEAR AND ONLY HOLD VOO, VXUS IN MY RRSP NOW.",f86d5y8,t3_dz7u6d,1574295352,1574320552.0,/r/CanadianInvestor/comments/dz7u6d/have_you_ever_beat_the_market_how/f86d5y8/
14,mohicks,CanadianInvestor,"YOUR DIVIDEND PER-QUARTER MUST BE LARGER THAN THE SHARE PRICE IN THE DAY THE DIVIDEND MONEY IS TRANSFERRED INTO YOUR ACCOUNT.  YOU NEED WAY MORE AAPL.

BTW THIS METHOD IS OFTEN CALLED ""SYNTHETIC DRIP"", WHILE A TRUE DRIP IS OFFERED BY SOME COMPANIES IF YOU DIRECTLY OWN THEIR STOCK (NOT THROUGH A BROKER), AND FRACTIONAL SHARES WILL BE PURCHASED WITH ALL CASH ISSUED AS A DIVIDEND.  (E.G., IN CANADA BCE, TELUS, BMO..)",f7l8q1c,t3_dwt03d,1573835155,1573860355.0,/r/CanadianInvestor/comments/dwt03d/drip_operation_within_rbc_direct_investing/f7l8q1c/
15,canadave_nyc,CanadianInvestor,"YEAH, I GUESS THAT'S WHAT I'M GETTING AT. LIKE, IF I FEEL CONFIDENT ENOUGH THAT A STOCK IS GOING TO GO DOWN, PRESUMABLY BECAUSE I THINK I'M GOOD AT ANALYZING STOCKS, THEN PRESUMABLY I WOULD BE JUST AS GOOD AT GUESSING WHEN A STOCK IS GOING TO GO UP. AND SO, ALL THINGS BEING EQUAL, I GUESS I'VE JUST NEVER UNDERSTOOD WHY IF I'M EQUALLY GOOD AT GUESSING WHETHER A STOCK WILL GO UP OR DOWN, WHY WOULD I TAKE A CHANCE ON SUFFERING INFINITE LOSSES (BY SHORTING A STOCK AND WATCHING IT SOAR LIKE AAPL), WHEN I COULD DO EXACTLY THE SAME PREDICTIVE ANALYSIS TO FIND A STOCK THAT I THINK WILL GO UP, AND THUS I AM HOPING FOR THE SAME RETURNS, BUT MUCH LESS RISK (ONLY RISKING THE CAPITAL I INVEST)? IT'S NEVER MADE SENSE.",f7k47rw,t3_dwe7v9,1573794200,1573819400.0,/r/CanadianInvestor/comments/dwe7v9/justification_for_shorting/f7k47rw/
16,DividendEarner,CanadianInvestor,"MY PORTFOLIO IS HERE: HTTPS://WWW.DIVIDENDEARNER.COM/DIVIDEND-STOCKS-PORTFOLIO/

STOCKS LIKE ATD.B, IFC, CNR, V, MA, MSFT, AAPL, TXN",f7eg3h1,t3_dvn35o,1573656691,1573681891.0,/r/CanadianInvestor/comments/dvn35o/who_has_accumulated_the_highest_tfsa_balance/f7eg3h1/
17,hasbs,CanadianInvestor,AAPL,f6ggddk,t3_dr4t0b,1572825611,1572850811.0,/r/CanadianInvestor/comments/dr4t0b/what_stocks_are_you_looking_to_buy_in_november/f6ggddk/
18,DividendEarner,CanadianInvestor,"IT’S REGULARLY DONE AND WILL NOT HAVE A VISUAL IMPACT ON A SPECIFIC DAY OUTSIDE OF REDUCING TRADING VOLUME. 

ETFS WILL BE THE ONE RAISING PRICES AS THEY ADJUST THEIR HOLDINGS SINCE THE VOLUME WILL BE LESS. ANALYSTS WILL ADJUST THEIR EPS AND PRICE TARGETS OVER TIME.

THIS APPROACH IS USED BY ALL LARGE CAP STOCKS. MSFT, AAPL, AND SO FORTH. IT’S VERY COMMON WHEN THE COMPANIES GENERATE MASSIVE AMOUNT OF CASH.

IT’S ALSO USED REGULARLY TO OFFSET EMPLOYEE STOCK GRANTS. THE COMPANY MAY GRANT 20M SHARES ANNUALLY TO EMPLOYEES SO THEY BUY BACK TO AVOID DILUTING THE STOCKS. 

EMPLOYEE STOCK IS A COMPENSATIONS IN NEARLY ALL PUBLICLY TRADED COMPANIES. THIS IS NEW STOCKS GRANTED ANNUALLY AND COMPANIES WILL BUY BACK TO OFFSET THOSE NEW GRANTS.",f55oizg,t3_dmwc0y,1572011108,1572036308.0,/r/CanadianInvestor/comments/dmwc0y/td_bank_group_announces_intention_to_repurchase/f55oizg/
19,DividendEarner,CanadianInvestor,"MINE IS HERE:

HTTPS://WWW.DIVIDENDEARNER.COM/DIVIDEND-STOCKS-PORTFOLIO/

DONE REALLY WELL WITH AAPL, MSFT, V, MA, COST

ATD.B, CNR AND IFC ON THE CANADIAN SIDE.",f45go8y,t3_dji45n,1571376345,1571401545.0,/r/CanadianInvestor/comments/dji45n/what_does_everyones_portfolio_look_like/f45go8y/
20,angelus97,CanadianInvestor,THE BENEFIT IS THAT IT'S AN ETF AND YOU CAN ACCESS IT THROUGH DIRECT INVESTING. SOLD SOME AAPL AND WANT TO BE PATIENT BEFORE MAKING YOUR NEXT PURCHASE? THROW IT IN PSA AND EARN SOME CASH WHILE YOU WAIT.,f3uyavb,t3_dibyg0,1571169030,1571194230.0,/r/CanadianInvestor/comments/dibyg0/is_there_an_etf_thats_like_alterna_bank_25_yield/f3uyavb/
21,bluebeardxxx,CanadianInvestor,"THKS ...SOME GOOD SUGGESTIONS....I HAVE TOO MANY CANNABIS STOCKS RIGHT NOW...
MAYBE 10 MORE SHARES OF $AAPL",f3gvt2e,t3_dgwxdp,1570915743,1570940943.0,/r/CanadianInvestor/comments/dgwxdp/christmas_retail/f3gvt2e/
22,bluebeardxxx,CanadianInvestor,I BOUGHT $AAPL IN 2009 BECAUSE I RECEIVED AN CLASSIC IPOD,f3fk0uk,t3_dgwxdp,1570898299,1570923499.0,/r/CanadianInvestor/comments/dgwxdp/christmas_retail/f3fk0uk/
23,throw0101a,CanadianInvestor,"&GT; ABSOLUTELY NOT HAHA... I PICKED MSFT 3 YEARS AGO BECAUSE I THOUGHT THEIR CLOUD REVENUE WOULD GROW WITH 0365.

MANY YEARS AGO I PICKED BOTH AAPL AND RIMM. ONE DID BETTER THAN THE OTHER. :)",f085vtv,t3_d44v98,1568475781,1568500981.0,/r/CanadianInvestor/comments/d44v98/the_irrelevance_of_dividends_ben_felix/f085vtv/
24,01011970,CanadianInvestor,I HAVE NO INTEREST IN THE PRODUCT AS IT'S GENERALLY DEGENERATE. BUT SELLING NOW COULD BE LIKE SELLING MSFT OR AAPL WHEN THEY WERE $5 A SHARE BECAUSE WHO NEEDS MORE THAN 640KB OF RAM?,ewzjixd,t3_cqtcol,1565896668,1565921868.0,/r/CanadianInvestor/comments/cqtcol/future_of_cannabis_stock_in_canada/ewzjixd/
25,GamblingMikkee,CanadianInvestor,"FB, IBM, AAPL?",ew5dow0,t3_cmx04i,1565133761,1565158961.0,/r/CanadianInvestor/comments/cmx04i/should_i_diversify_more_or_add_to_my_existing/ew5dow0/
26,whatyoulookinatbud,CanadianInvestor,"I'VE ALWAYS THOUGHT AAPL LACKED INNOVATION AND WOULDN'T INCREASE IN VALUE, BUT THEY'VE PROVED ME WRONG EVERY SINGLE TIME. I WOULD JUST TRIM YOUR POSITION BACK TO 5-10% IF I WAS IN YOUR SHOES.

&AMP;#X200B;

GOOGLED THE IPHONE 11 PHOTOS YOU MENTIONED, UGLY AF. HIGHLY DOUBT AAPL WOULD KEEP THAT DESIGN. I'VE ALSO HEARD RUMORS THEY'RE WORKING ON AN IN SCREEN FINGER PRINT AND IN SCREEN CAMERA. THE CAMERA WOULD BE COOL IF THEY GOT IT TO WORK.",evc9zoa,t3_cjbm6e,1564410247,1564435447.0,/r/CanadianInvestor/comments/cjbm6e/aapl_keep_or_sell/evc9zoa/
27,ZivSerb,CanadianInvestor,"THAT’S A RATHER VAGUE AND GENERALIZED STATEMENT. HAVE YOU LOOKED AT A CHART OF THE S&AMP;P IN THE LAST YEAR AND A HALF? THERE’S BEEN A BIT OF VOLATILITY LOL. INDIVIDUAL STOCKS WORK IF YOU HAVE A GENERAL SENSE OF HOW TO FOLLOW THE MONEY. LET’S SAY YOU BOUGHT AAPL AT ATHS WITHOUT A DCA OR OVERWEIGHT POSITION, ANYTHING CRUDE PRE DECEMBER LOWS, HEALTH CARE, BASIC MATERIALS, TRANSPORTS, SOMETHING SMALL CAP. THAT IS ALL DEEPLY ENTRENCHED IN A BEAR MARKET. WHEN THE MARKET IS VOLATILE AND PERCEIVABLY TOPPY THEN TIMING BEATS TIME IN.",ev2b74i,t3_cggr5s,1564173717,1564198917.0,/r/CanadianInvestor/comments/cggr5s/when_would_be_a_right_time_to_ever_sell_etfs_like/ev2b74i/
28,DividendEarner,CanadianInvestor,"I WOULD DITCH ALL YOUR CANADIAN STOCKS AND BUY US STOCKS. 

GO BUY VISA, AAPL/MSFT, A PHARMA STOCK AND STICK TO CANADIAN BANKS

WHAT’S THE POINT OF HOLDING THEM? IF YOU ARE IN FOR 20 YEARS THE CURRENCY EXCHANGE SHOULD NOT BE A BLOCKER.

MY PORTFOLIO IS 50% US STOCKS.
HTTPS://WWW.DIVIDENDEARNER.COM/DIVIDEND-STOCKS-PORTFOLIO/

AFTER THAT YOU WANT TO CONSIDER TAX EFFICIENCY FOR THE ACCOUNTS YOU USE",ev295zt,t3_ci5e6z,1564172674,1564197874.0,/r/CanadianInvestor/comments/ci5e6z/portfolio_feedback_and_recommendation/ev295zt/
29,FelixYYZ,CanadianInvestor,"&GT;MY QUESTION IS ; WHERE DO I HOLD MY US GROWTH STOCKS - AMZN , FB , AAPL ?

APPL PAYS A DIVIDEND, SO IF YOU DON'T WANT TO PAY THE 15% WITHHOLDING TAX ON THE DIVIDEND, IT GOES INTO AN RRSP. FOR AMZON AND FB, A TFSA IS FINE.

&GT;I HAVE HEARD ABOUT US WITHHOLDING TAX - WOULD I BE TAXED 15% OF MY CAP GAINS WHEN I SELL ALL 3 US COMPANIES IN 10 YEARS? 

THE WITHHOLDING TAX IS ON DIVIDENDS, NOT CAPITAL GAINS.

FOR WHERE YOU SHOULD KEEP YOUR CDN DIVIDEND STOCKS, DEPENDS, WHEN YOU ARE GOING TO RETIRE AND LIVE OFF THE DIVIDENDS. IF IT'S A LONG WAY AWAY, A TFSA &GT; TAXABLE ACCOUNT. RRSP IS FINE FOR US DIVIDENDS .",euals6a,t3_cfkj9f,1563624389,1563649589.0,/r/CanadianInvestor/comments/cfkj9f/dividend_income_strategy/euals6a/
30,DividendEarner,CanadianInvestor,"&GT;(IMAGINE IF THEY KNEW THAT THE STOCK PRICE DECREASES BY THE DIVIDEND AMOUNT AT THE EX-DIV DATE)

THAT'S HOW IT'S SUPPOSED TO WORK TECHNICALLY BUT IN REALITY, THAT'S ALL BULLSHIT SINCE THE STOCK PRICE MOVES ACCORDING TO WHOMEVER BUYS OR SELL ON THAT DAY. SO THAT'S REALLY NOT RELEVANT.

DIVIDENDS WHEN RE-INVESTED DO INCREASE TOTAL RETURNS ?!? IT'S A FREE SHARE OR MORE DEPENDING ON THE DIVIDEND YOU EARN.

THERE ARE GREAT DIVIDEND STOCKS LIKE V, MA, COST, MSFT, AAPL THAT PAY A DIVIDEND, REINVEST, AND DO BUYBACKS.",etzfwwj,t3_ce352q,1563331246,1563356446.0,/r/CanadianInvestor/comments/ce352q/dividend_growth_stocks_with_increasing_dividends/etzfwwj/
31,catsaysmrau,CanadianInvestor,"&GT; KIND OF USING THESE **US** GROWTH COMPANIES AS AN ATM THANKS

&GT; CURRENTLY I HAVE AMZN, FB, AAPL AND **CGC**


UMMM... YOU KNOW YOU CAN JUST HOLD WEED AND THAT IT'S THE SAME AS CGC, JUST ON THE TSX AND IN CAD, RIGHT?",et6zgyo,t3_ca5tah,1562521942,1562547142.0,/r/CanadianInvestor/comments/ca5tah/whats_the_best_account_to_hold_us_stocks_in_hate/et6zgyo/
32,DividendEarner,CanadianInvestor,"AS OTHERS POINT OUT, ONLY US DIVIDEND STOCKS HAVE A WITHHOLDING TAX OUTSIDE OF A RRSP.

IS IT REALLY A BIG DEAL OVERALL? THINK ABOUT IT - AAPL PAYS 1.51% AND THE WITHHOLDING TAX IS 15% OF THE DIVIDEND  OF .2265%. IT'S VERY NEGLIGIBLE.

MY RRSP ACCOUNTS ARE FULL OF US STOCKS AND I HAD TO OVERFLOW INTO MY TFSA AND NON-REGISTERED ACCOUNT TO BUY US. THE CHOICE I MAKE IS HIGH YIELD IN RRSP AND LOW YIELD OUTSIDE LIKE VISA OR MASTERCARD.",et6tanq,t3_ca5tah,1562518948,1562544148.0,/r/CanadianInvestor/comments/ca5tah/whats_the_best_account_to_hold_us_stocks_in_hate/et6tanq/
33,Real_Iron_Sheik,CanadianInvestor,"HOW DO YOU DEFINE PERFORMANCE? IF YOU ADJUST FOR RISK, IT'S DEBATABLE WHETHER XUS/VFV HAVE OUTPERFORMED XGRO/VGRO (KEEP IN MIND THAT THE LATTER HAVE 20% IN BONDS). IT'S SIMILAR TO ASKING WHY GIVEN THE OUTPERFORMANCE OF A PARTICULAR STOCK (SAY $AAPL) ANYONE WOULD CHOOSE XUS/VFV? IN BOTH CASES THE OUTPERFORMANCE CAN BE EXPLAINED BY HIGHER RISK, WHICH SOME PEOPLE MAY NOT BE COMFORTABLE WITH.

FWIW: WARREN BUFFETT HAS RECOMMENDED 90% S&AMP;P 500 ETF (SO SOMETHING LIKE XUS/VFV PRESUMABLY) AND 10% SHORT-TERM BONDS, SO IT CAN'T BE TOO TERRIBLE EITHER WAY LOL.",et19yal,t3_c9pkrq,1562394073,1562419273.0,/r/CanadianInvestor/comments/c9pkrq/xgrovgro_vs_xusvfv_why_choose_one_over_the_other/et19yal/
34,Takeoutcontainer,CanadianInvestor,HEY CAN YOU EXPAND ON THAT BIT? I HAVE SOME AAPL IN MY TFSA. I SHOULD KEEP IT IN A NON-REGISTERED INSTEAD?,eryejfe,t3_c4qz10,1561406765,1561431965.0,/r/CanadianInvestor/comments/c4qz10/buy_into_msft_or_just_stick_with_vgro/eryejfe/
35,Sneaky_Jim,CanadianInvestor,"WHAT MAKES YOU WANT TO BUY MSFT? HAVE YOU DONE A LOT OF RESEARCH? WHAT MULTIPLES ARE YOU CONSIDERING IN YOUR VALUATION?ARE YOU CERTAIN THAT MSFT IS GOING TO OUTPERFORM THE MARKET? WHY NOT AMZN OR AAPL INSTEAD? 

SORRY, I'M BEING AN ASS, BUT YOU NEED TO BE EXTREMELY CAREFUL IF YOU WANT TO BRANCH OUT AND SELECT INDIVIDUAL SECURITIES FOR YOUR PORTFOLIO. YOU COULD DO REALLY WELL, OR YOU COULD MISS OUT ON A LOT OF UPSIDE IF MICROSOFT HAS A FEW BAD YEARS RELATIVE TO THE MARKET. I'M NOT SAYING THAT MICROSOFT IS POORLY MANAGED, BUT EVEN GREAT, DOMINANT COMPANIES CAN HAVE DOWNFALLS AS A RESULT OF A FEW POOR MANAGEMENT CHOICES (THINK BLACKBERRY OR NOKIA, ETC).

IF YOU'RE PUTTING A LOT OF RESEARCH INTO PICKING INDIVIDUAL SECURITIES, THERE'S A SMALL CHANCE (WITH SOME LUCK) THAT YOU CAN OUTPERFORM IN THE LONG RUN. BUT ALL I'M SAYING IS THAT YOUR PROBABLY MUCH BETTER OFF STICKING TO VGRO AND PLAYING IT SAFE WITH YOUR SAVINGS. LET THE PROS PICK STOCKS, IMO.",eryckl9,t3_c4qz10,1561405513,1561430713.0,/r/CanadianInvestor/comments/c4qz10/buy_into_msft_or_just_stick_with_vgro/eryckl9/
36,pcfang,CanadianInvestor,"BUY USD STOCKS ARE WAY BETTER THAN CAD STOCKS.  MY USD HAVE OUTPERFORMED BY FAR.. STOCKS I OWN AAPL, GOOGL, MA, V TO NAME A FEW.  START WITH A TFSA ACCOUNT SO YOUR GAINS ARE TAX FREE.",erv8wyb,t3_c46mu2,1561309526,1561334726.0,/r/CanadianInvestor/comments/c46mu2/stocks_to_buy_anytime/erv8wyb/
37,jostrons,CanadianInvestor,"REITS - BTB.UN (DON'T PAY OVER 4.67 WITHIN THE NEXT MONTH) REI.UN - WOULDN'T GET IN ABOVE $25'

BANKS - TD, RBC, BMO

UTILS - ENBRIDGE &AMP; ENCANA

MISC US. - AMZN - LIKE IT AT 1,700S AS AN ENTRY POINT. AAPL. LIKE IT AT $170 AS AN ENTRY.

&AMP;#X200B;

OPEN SHORTS - WEED $72. BYND $170 USD. THOSE ARE MY #1 DAMN HYPE DOESN'T MAKE SENSE AND THEY GOTTA TAKE A LICKING.",erq4486,t3_c3cg27,1561134759,1561159959.0,/r/CanadianInvestor/comments/c3cg27/what_is_your_1_go_to_stock_regardless_of_bull_or/erq4486/
38,etienner,CanadianInvestor,"I HAVE NOTHING AGAINST TECH,  AAPL FOR EXAMPLE IS FAR FROM BEING OVERVALUED, SO IS MSFT.  BUT MY POINT IS THAT WE CANNOT KNOW FOR SURE WHICH SECTOR WILL OUTPERFORM IN THE NEXT 20 YEARS.  ALL I KNOW IS, US STOCKS HAVE BEEN THAT EXPENSIVE TWICE, IN 2000 AND IN 1929.  IN BOTH CASES IT DIDN'T END WELL.  LOW INTEREST RATES AND THE FACT THAT THE US ECONOMY IS GOING SO WELL MADE INVESTORS INVEST A LOT IN US STOCKS, WHICH MADE THEM EXPENSIVE.  SO EVEN IF CANADIAN STOCKS DON'T EVEN GROW HALF AS MUCH AS US STOCKS FOR THE NEXT 15 YEARS, THEY COULD STILL OUTPERFORM BECAUSE OF VALUATION.  WHAT WE KNOW RIGHT NOW IS THAT YOU PAY TWICE AS MUCH FOR EACH $1 OF PROFIT WHEN YOU BUY STOCKS.  AND AT CURRENT VALUATIONS, US STOCKS NEVER RETURNED MORE THAN 5% ANNUALLY FOR THE FOLLOWING 10 YEARS.",emgpdt4,t3_bkg3nq,1556943285,1556968485.0,/r/CanadianInvestor/comments/bkg3nq/100_percent_american_portfolio_longterm/emgpdt4/
39,RipplesOfFaith,CanadianInvestor,"I PERSONALLY WOULD NOT PURCHASE BOTH SINCE THEY'RE FUNDAMENTALLY SIMILAR. IF I HAD TO PICK, I WOULD PURCHASE XGRO SINCE 1) THE MANAGEMENT FEE IS SLIGHTLY LOWER (0.18% VS 0.22%) AND 2) I LIKE THAT XGRO CONTAINS SLIGHTLY MORE TECH SHARES (E.G., MSFT, AAPL, AMZN) THAN BANKS AND ENB, BUT THAT'S JUST MY PERSONAL PREFERENCE.",em8knmq,t3_bjifnh,1556729189,1556754389.0,/r/CanadianInvestor/comments/bjifnh/is_holding_both_xgro_vgro_in_a_tfsa_a_dumb_idea/em8knmq/
40,19Black,CanadianInvestor,"100% + GAINERS: WEED, AMZN, LMT

OTHER STOCKS IN PORTFOLIO: AAPL (AVG $142), TD ($49), APHA ($12.78)
 
JUST SOLD DIS THIS MORNING FOR A 22% PROFIT AFTER BUYING AT THE START OF THE MONTH. PLAN TO BUY MORE AAPL IN THE MORNING AND RIDE THE WAVE.",em76zwv,t3_bik3hg,1556683558,1556708758.0,/r/CanadianInvestor/comments/bik3hg/what_are_your_top_5_stocks_in_your_portfolio/em76zwv/
41,marketgodfather,CanadianInvestor,"OH THAT'S THE OTHER THING, AVOID STOCKS UNDER $10 THEY ARE GARBAGE. YOU COULD HAVE BOUGHT TWTR/AMD/AAPL EARLIER THIS YEAR AND MADE A GOOD RETURN. USUALLY THE MORE POWERFUL STOCKS MOVE FASTER.

BUYING CALLS/PUTS DOESN'T REQUIRE HOLDING STOCKS, BUT YOU CAN LOSE THAT $2,500 REALLY FAST. IF YOU WANT TO SEE LOSING LOOK AT /R/WALLSTREETBETS, JUST READ IT FOR A FEW WEEKS/MONTHS AND GET AN IDEA FOR WHAT'S HAPPENING. THEN READ /R/OPTIONS AND THAT WILL GIVE YOU MAYBE AN IDEA TO MAKE MONEY, A STRATEGY CALLED THE WHEEL IS GOOD FOR THAT, FOR SMALL GAINS TO START OPTIONS TRADING AND IF YOU ARE WILLING TO HOLD STOCK. 

SELLING PREMIUM IS REALLY RISKY (I.E. SELLING CALLS/PUTS), IT'S EASIER TO BUY AT THE START.

YOU PROBABLY DON'T WANT TO TRADE OPTIONS ON YOUR TFSA.",ellh7uu,t3_bgk3k1,1556046870,1556072070.0,/r/CanadianInvestor/comments/bgk3k1/i_have_2500_saved_where_to_start/ellh7uu/
42,marketgodfather,CanadianInvestor,"EMERA IS A LARGE INVESTOR IN AQN. 

AQN IS TECH FOCUSED SO THEY CAN CUT OVER A LOT OF SMALL ASSETS. THEY STREAMLINE OPERATIONS FOR THE OTHER UTILITIES AND IN TURN HAVE LESS SUPPORT STAFF AT THE INDIVIDUAL UTILITY LEVEL AND CAN DO CONTROL MOST OF THE ADMINISTRATIVE FUNCTIONS FROM A CENTRALIZED LOCATION. THEIR CURRENT LEADERSHIP TEAM IS EXCELLENT AND ABLE TO LOOK FORWARD. THEY ARE TECHNICALLY AWARE AND IF YOU HAVE THAT AT THE C-LEVEL IT HELPS PUSH THE ORGANIZATION FORWARD, ESPECIALLY IN THIS DAY AND AGE.

*I HAVE NO POSITION IN AQN, ONLY INFORMED THROUGH MY NETWORK. THE SENIOR EXECUTIVES AT THIS ORGANIZATION ARE FORWARD THINKING. I DON'T HOLD ANY UTILITY STOCK INVESTMENTS EITHER. I DON'T LIKE THE MINIMAL RETURNS ON UTILITIES AND MY POSITIONS ARE MAINLY AAPL/SPY/TSLA (REALLY SMALL POSITION) AND OPTIONS TRADING. I DO NOT RECOMMEND BUYING THEM IN ANY SENSE BECAUSE I HAVE NO OPINION ON THE FUTURE OF THIS ORGANIZATION.",elfr0cd,t3_bfpg4p,1555868306,1555893506.0,/r/CanadianInvestor/comments/bfpg4p/why_did_the_share_price_for_aqn_a_utility/elfr0cd/
43,almonboy,CanadianInvestor,"WE'RE TALKING ABOUT AAPL HERE, RIGHT? 142 WAS THE 52-WEEK LOW.",el54026,t3_be9zvw,1555540266,1555565466.0,/r/CanadianInvestor/comments/be9zvw/thoughts_on_berkshire_hathaway_nyse_brkb/el54026/
