,author,subreddit,body,id,link_id,created_utc,created,permalink
88,TheSavingsGuy,CanadianInvestor,"IF YOU WANT 3% TO 4% OF PASSIVE INCOME ANNUALLY AND WANT TO ALLOCATE 80% OF YOUR PORTFOLIO TO ETFS, YOU EITHER NEED TO GET HIGHER YIELDING STOCKS OR ETFS. IN TERMS OF ETFS, YOU MIGHT WANT TO LOOK AT XEI OR ZRE.

CURRENTLY, THERE'S ALREADY OVERLAP IN YOUR PORTFOLIO BECAUSE VGRO OWNS U.S. AND INTERNATIONAL ETFS. FOR INSTANCE, MICROSOFT, APPLE, AND ALPHABET (GOOGLE) ARE AMONG THE TOP 10 HOLDINGS IN VGRO, VFV, AND VTI.",f749sky,t3_duc761,1573399636,1573424836.0,/r/CanadianInvestor/comments/duc761/looking_for_some_advice_on_my_retirement/f749sky/
89,tree-farmer,CanadianInvestor,"DEFINITELY LIKE CAMECO.  I ALSO OWN THEM.  I THINK THE RISING SWU PRICE IS INDICATING A BOTTOM IN THE SECTOR BUT I'VE ALSO BEEN A YEAR EARLY.

I'M A DUMMY WHEN IT COMES TO TECH.  MICROSOFT SEEMS PRETTY GOOD BUT I CAN'T HELP BUT WONDER HOW LONG PEOPLE WILL BE WILLING TO OVERPAY FOR AN APPLE VS A PC/ANDROID.  THEY'RE NOT CUTTING EDGE LIKE THEY USED TO BE.  BUT TAKE THAT WITH A GRAIN OF SALT, I MIGHT BE A LUDDITE.",f6y77ik,t3_dtqcmu,1573269800,1573295000.0,/r/CanadianInvestor/comments/dtqcmu/what_would_you_do_if_you_were_in_my_shoes/f6y77ik/
90,Dcye98,CanadianInvestor,"TAKE A LOOK AT CCL B. THEY'RE A LABEL AND PACKAGING COMPANY. STOCK HASNT MOVED MUCH THE PAST 2/3 YEARS AND I THINK NOW'S THE TIME IT'S GOING TO POP TO GREATER HIGHS. GET SOME EXPOSURE TO INCREASING GLOBALIZATION OF AMAZON, APPLE, MICROSOFT ETC. SOLID MID CAP COMPANY TO ADD TO YOUR PORTFOLIO, IN MY OPINION.",f6y4j0k,t3_dtpr2h,1573267426,1573292626.0,/r/CanadianInvestor/comments/dtpr2h/investing_newbie_looking_for_advice_how_to_move/f6y4j0k/
91,mr_j936,CanadianInvestor,"TECH IS WEIRD, THAT IS WHY BUFFET HIMSELF STAYED OUT OF IT. HOW WOULD YOU VALUE SOMETHING FOR INSTANCE LIKE WINDOWS 10? WOULD YOU VALUE IT BASED ON HOW MANY MAN HOURS IT TOOK TO MAKE IT? OR WOULD YOU VALUE IT BASED ON HOW MANY USERS IT HAS AND HOW MANY BIG CORPORATIONS HAVE IT AS A BASE? ETC... IT IS DIFFICULT. ADD TO THAT A COMPANY CAN GO FROM SUPER SUCCESSFUL TO DEAD IN A YEAR OR 2, NOKIA SOLD MORE PHONES IN 2008 THAN ANDROID AND APPLE SOLD IN 2014 PUT TOGETHER, AND BY 2010 NOKIA WAS DEAD. STANDING IN 2008 AND LOOKING AT 2008 FACTS HOW WOULD YOU HAVE VALUED APPLE VS NOKIA?",f6msys2,t3_ds2deu,1572978264,1573003464.0,/r/CanadianInvestor/comments/ds2deu/intrinsic_value/f6msys2/
92,Shaun80,CanadianInvestor,APPLE HAS BEEN BEASTING LATELY LOVE IT.,f6gx9z3,t3_dr4t0b,1572832271,1572857471.0,/r/CanadianInvestor/comments/dr4t0b/what_stocks_are_you_looking_to_buy_in_november/f6gx9z3/
93,ShaidarHaran2,CanadianInvestor,"I'M SURE. THOUGH I ALSO REMEMBER IT BEING AT SWEET SWEET PARITY, WHEN APPLE HARDWARE ALMOST FELT AFFORDABLE!",f5ud8y7,t3_dp7seo,1572471607,1572496807.0,/r/CanadianInvestor/comments/dp7seo/bank_of_canada_holds_rates_warns_economy_will_be/f5ud8y7/
94,jugwhatever,CanadianInvestor,"I THINK A MIX IS FINE. IF YOUR EVENTUAL GOAL IS TO HAVE AN INCOME STREAM, TO ME IT MAKES SENSE TO START BUILDING IT ASAP AND GROW IT GRADUALLY OVER TIME, RATHER THAN PUT ALL YOUR HORSES ON CAPITAL GROWTH AND PLAN FOR ONE BIG TRANSITION TO A COMPLETELY NEW INVESTING STRATEGY SOME DAY. IT ALSO GIVES YOU A MULTI YEAR PERIOD IN WHICH TO DISCOVER GOOD COMPANIES WITH GROWING DIVIDENDS, AND LOCK IN THOSE YIELDS AS OPPORTUNITIES ARISE. 

BUT, IF YOU CAN’T FIND ENOUGH COMPANIES THAT FIT YOUR CRITERIA AND PROVIDE A GOOD, GROWING YIELD, NO HARM ADDING A VISA OR AN APPLE OR WHATEVER TO GO FOR CAPITAL GAINS, RATHER THAN BUY MANULIFE OR SOMETHING JUST BECAUSE IT PAYS A DIVIDEND.",f5rwq28,t3_doy0fy,1572404842,1572430042.0,/r/CanadianInvestor/comments/doy0fy/which_investment_strategy_would_best_help_me/f5rwq28/
95,Shaun8030,CanadianInvestor,"BAM , SHOP , APPLE VISA MSFT DISNEY MASTERCARD GOOGLE IN TFSA .  VGT AND VUG IN RRSP.  YTD HAS BEEN GREAT, MADE UP FOR DEC 2018 DROP AND MUCH MORE OVERALL. RISKY PORTFOLIO BUT PLAN TO HOLD LONG CAN'T HANDLE THE SWINGS",f5oc49u,t3_dobnb5,1572314564,1572339764.0,/r/CanadianInvestor/comments/dobnb5/are_you_beating_the_overall_market_honest_answers/f5oc49u/
96,LuxGang,CanadianInvestor,"TERRIBLE COMPANY TO OWN FOR THE LONG TERM. 

WHY WOULD ANYONE WANT TO PAY $15 FOR A TICKET, $7 FOR A SMALL POPCORN, AND $5 FOR A SODA, JUST TO SIT IN A STICKY CHAIR WITH KIDS YELLING OR KICKING THE BACK OF YOUR CHAIR DURING THE MOVIE?

IN A WORLD OF NETFLIX, AMAZON PRIME, AND APPLE TV, MOVIE THEATRES ARE ALL BUT DEAD. DON'T BUY THIS PIECE OF CRAP. IF YOU WANT DIVIDENDS, BUY A BANK, UTILITY, OR TELECOM.",f3xhj1k,t3_dimfqu,1571238381,1571263581.0,/r/CanadianInvestor/comments/dimfqu/thoughts_on_cineplex/f3xhj1k/
97,Sweetness27,CanadianInvestor,"I'M PRETTY SIMILAR TO THIS. NOT AS CLEAN THOUGH. RRSP MATCHING THROUGH WORK HAS REALLY REDUCED MY CONTROL ON THINGS. GONNA TAKE YEARS TO GET IT ALL HOW I WANT IT. ALSO I PUT PROCEEDS OF MY RENTAL TO AN ACTIVE RRSP FUND SO THAT DISTORTS IT FURTHER (WIFE FELT BETTER WITH THAT, AND TRUTH BE HONEST I'M NOT THE MOST DISCIPLINED INVESTOR SO I DIDN'T FIGHT IT). BUT I WANT MY PERSONAL TFSA TO LOOK LIKE THIS, MINUS BONDS WHICH I'M COVERED WITH IN OTHER AREAS. 

~50% VEQT MAINLY BUT ALSO ZDI, ZDV(ABOUT 5%). I LIKE DIVIDENDS, REGARDLESS OF WHAT THE MATH SAYS. I JUST LIKE THAT MONEY COMING IN. 

BEP.UN UP 50%, RNW UP 1%, HAHA SO WE MUST HAVE HAD DIFFERENT TIMING ON THOSE. AQN UP 60%, ALA DOWN 37%(I STILL BELIEVE!)

10% XGD BECAUSE WHY NOT

NOT BIG ON REITS JUST BECAUSE I HAD A HOUSE AND RENTAL, SEEMED ENOUGH BUT CHP.UN HAS BEEN SOLID. 

RANDOM STOCK PICKS; GOOGLE (GREAT), APPLE (GREAT), SIS(WAS UNBELIEVABLE BUT COOLED DOWN, STILL HOLDING LONGTERM), NFLX (THOUGHT IT WAS A DIP, I WAS WRONG), TESLA (JUST SOLD AT BREAKEVEN)

THEN THERE'S A FEW UNMENTIONABLES THAT I AM GOING TO SAY WERE EXPENSIVE LESSONS.",f3qx2bo,t3_dhstqw,1571082164,1571107364.0,/r/CanadianInvestor/comments/dhstqw/vgro_investors_what_other_stock_etf_bond_and_reit/f3qx2bo/
98,luislovesmoney,CanadianInvestor,"WHICHEVER ONE HAS THE TICKLE ME ELMO OF THE MOMENT. HOWEVER, UNEXPECTED UNICORN SUCCESS WITH TOYS DOES NOT GUARANTEE SUCCESS IF THEY HAVEN’T PRODUCED ENOUGH.

OR I LIKE COMPANIES LIKE TIFFANY OR PVH THAT HAVE PRODUCTS I’LL BE ASKING FOR, OR APPLE FOR THE APPLE WATCH SALES(ANECDOTE HERE: RECENTLY HEARD THAT A STORE IN TOWN THAT BUYS WATCHES HAS HAD A LOT OF PEOPLE TURNING IN FANCY WATCHES BECAUSE THEY GOT APPLE WATCH), MAYBE FACEBOOK FOR AD REVENUE INCREASES OVER XMAS. HMMM AND MAYBE WEED COMPANIES FOR WEED 2.0 ROLLOUT IN CANADA AND ASSORTED SALES AS RELATED NOVELTY XMAS GIFTS, THIS MIGHT BE TOO MINIMAL AT FIRST THOUGH BECAUSE OF SUPPLY CHAIN BOTTLENECKS ATM.",f3glxgt,t3_dgwxdp,1570912762,1570937962.0,/r/CanadianInvestor/comments/dgwxdp/christmas_retail/f3glxgt/
99,ShaidarHaran2,CanadianInvestor,"SAY THEY CONTINUE TO NEVER POST A PROFIT UNTIL THEN. WOULD ALL VENUES OF RAISING CAPITAL HAVE DRIED UP BY 2021? ISSUING NEW SHARES, OR PRIVATE EQUITY? WHAT IS THEIR DATASET OF BY FAR THE MOST DRIVEN MILES (AND SITUATIONS ENCOUNTERED BY EXTENSION) WORTH TO A WAYMO OR APPLE?",f3g35n3,t3_ddfwf1,1570906899,1570932099.0,/r/CanadianInvestor/comments/ddfwf1/tsla/f3g35n3/
100,22Simon22,CanadianInvestor,"JUST SPEND AN HOUR LOOKING AT WEBULL APP FOR IPHONE, IT LOOKS GOOD LOTS OF DATA.
I HAD TO GOOGLE HOW TO SETUP A SIMULATED HOLDING WATCHLIST, BUT I GOT IT!

SO I’VE ENTERED 2 POSITION THAT I OWN, APPLE AND TELUS, JUST TO SEE HOW IT WOULD SHOW AND STUFF..

OP ASK ABOUT DAY TO DAY GRAPH SHOWING HIS HOLDING, I COULDN’T FIND ANYTHING LIKE IT ON THE APP SO FAR.

IT’S NICE TO HAVE A GRAPH THAT SHOW YOU YOUR PORTFOLIO VALUE RELATIVE TO TIME, I USE PORTFOLIOTRADER ON MY IPHONE YOU CAN HAVE A NICE GRAPH LIKE THIS ONE: [GRAPH](HTTPS://IMGUR.COM/FFQIMWS)",f3aa2z9,t3_dg1ig9,1570765810,1570791010.0,/r/CanadianInvestor/comments/dg1ig9/how_to_track_performance/f3aa2z9/
101,lampcouchfireplace,CanadianInvestor,"KEEP IN MIND THAT EVERYTHING IS DOWN AT THE MOMENT. EVEN BALANCED, WELL DIVERSIFIED ETF PORTFOLIOS ARE PRETTY MUCH ALL DOWN OVER THE LAST MONTH.

IF YOU WANT TO INVEST IN VOLATILE SECTORS, YOU NEED TO BE PREPARED TO WEATHER SOME LOSSES AND HOLD IF YOU BELIEVE IN THE COMPANY'S FUNDAMENTALS AND THE SECTOR'S LONG TERM POTENTIAL. YOU'LL ALWAYS LOSE IF YOU SELL OFF EVERY TIME THERE'S A DROP IN VALUE.

EVEN SOMETHING LIKE APPLE IS UP FOR THE LAST 12 MONTHS, BUT THERE ARE SEVERAL TIMES YOU COULD'VE LOCKED IN 20%-40% LOSS BY SELLING.",f3aa2bs,t3_dg8ntw,1570765794,1570790994.0,/r/CanadianInvestor/comments/dg8ntw/are_there_any_green_energy_stock_folks_like/f3aa2bs/
102,kerouac01850,CanadianInvestor,"NO CHOICE BUT TO SELL THE UNDERLYING APPLE OR GOOGLE SECURITIES IN THE LONG TERM OR PLAY WITH OPTIONS FOR SHORT TERM INCOME. THIS IS FAR TOO SPECULATIVE FOR MY STAGE OF RETIREMENT. I'D RATHER PLAY THE ETF PERIODIC RE-BALANCING ACT TO MANAGE THIS KIND OF EQUITY GROWTH.

I'LL TAKE YOUR TIP, THANK YOU FOR THAT, AND CONTINUE TO LEARN TO USE FINANCIAL STATEMENTS TO MAKE A DECISION. I'M ALSO LOOKING AT DIR.UN.",f30f2jl,t3_de7loz,1570552991,1570578191.0,/r/CanadianInvestor/comments/de7loz/reit_or_bank_stocks/f30f2jl/
103,dster35,CanadianInvestor,"THANKS FOR THE LINK. I WAS INTERESTED IN FUNDS WITH A LONG HISTORY OF HOLDING THEIR PRICE AND A STEADY INCOME AND IT FIT THE BILL PRETTY WELL.  THEY HAVE BEEN RAISING MONEY AND BUYING MORE PROPERTY SINCE I’VE BEEN BUYING IT, AND THE BUSINESS HAS BEEN GROWING.  I’M HOPING IT STAYS A BIT BORING AND KEEPS PAYING.
THAT SAID THERE’S A BUNCH I JUST DON’T GET THE MARKETS. WHY WOULD SOMEONE BUY APPLE OR GOOGLE - ARGUABLY SOME OF THE MOST PROFITABLE COMPANIES IN HISTORY, IF THEY’VE NEVER PAID INVESTORS ANY PROFITS? SO TAKE MY TIPS WITH A GRAIN OF SALT!",f2z0fqa,t3_de7loz,1570502973,1570528173.0,/r/CanadianInvestor/comments/de7loz/reit_or_bank_stocks/f2z0fqa/
104,dster35,CanadianInvestor,"THANKS FOR THE LINK. I WAS INTERESTED IN FUNDS WITH A LONG HISTORY OF HOLDING THEIR PRICE AND A STEADY INCOME AND IT FIT THE BILL PRETTY WELL.  THEY HAVE BEEN RAISING MONEY AND BUYING MORE PROPERTY SINCE I’VE BEEN BUYING IT, AND THE BUSINESS HAS BEEN GROWING.  I’M HOPING IT STAYS A BIT BORING AND KEEPS PAYING.
THAT SAID THERE’S A BUNCH I JUST DON’T GET THE MARKETS. WHY WOULD SOMEONE BUY APPLE OR GOOGLE - ARGUABLY SOME OF THE MOST PROFITABLE COMPANIES IN HISTORY, IF THEY’VE NEVER PAID INVESTORS ANY PROFITS? SO TAKE MY TIPS WITH A GRAIN OF SALT!",f2z0ck2,t3_de7loz,1570502908,1570528108.0,/r/CanadianInvestor/comments/de7loz/reit_or_bank_stocks/f2z0ck2/
105,FelixYYZ,CanadianInvestor,"THE ALL IN ONE ETF PORTFOLIOS ALL HAVE THE SAME ALLOCATION TO TECH SINCE THEY OWN THE UNDERLYING ETFS (BALCKROCK, BMO AND VANGUARD WILL HAVE SLIGHTLY DIFFERENT ALLOCATIONS DUE TO THEIR UNDERLYING HOLDINGS.

PERSONALLY I WOULD JUST GET THE ONE ETF AND JUST KEEP DUMPING MONEY INTO IT. IF TECH STOCKS START GETTING A BIGGER SHARE OF THE MARKETS (BESIDES APPLE, MICROSOFT GOOGLE, ETC...) THEY WOULD BE PUT INTO THE INDICES DUE TO A LARGER MARKET CAP.",f24g3a1,t3_dbv5sp,1569951225,1569976425.0,/r/CanadianInvestor/comments/dbv5sp/2_etf_portfolio_with_larger_exposure_to_tech/f24g3a1/
106,nababaneabs,CanadianInvestor,"I HATE APPLE AS A COMPANY. I THINK THEY MAKE SHIT PRODUCTS. I THINK THEY HAD A TERRIBLE INFUENCE ON THE TECH COMMUNITY AND JUST CULTURE IN GENERAL. ALSO THE CONDITIONS THEIR FACTORY WORKERS ARE IN ARE ATROCIOUS. I HOPE STEVE JOBS IS BURNING IN HELL.

WITH THAT SAID IF I FELT APPLE WOULD MAKE ME MONEY DAMN RIGHT I'D INVEST.

I'M IN THIS SOLELY FOR THE MONEY.",f0yy84q,t3_d6yqsz,1569081665,1569106865.0,/r/CanadianInvestor/comments/d6yqsz/trading_without_emotion/f0yy84q/
107,walythewalrus,CanadianInvestor,"THIS ARTICLE IS FUNDAMENTALLY FLAWED. I'M NOT SURE YOU KNOW HOW COMPANIES WORK. I OWN APPLE STOCK, THAT DOES NOT MEAN THE PERCENTAGE OF THE SHARES I OWN RESULT IN THAT PERCENTAGE OF APPLE'S PROFITS GOING TO CANADA.....THE MAJORITY OF CANADIAN COMPANIES WOULD HAVE MOST OF THEIR SHAREHOLDERS BE IN FOREIGN COUNTRIES FROM THE SIMPLE FACT THAT CANADA IS A SMALL COUNTRY AND HAS A SMALL INVESTMENT BASE VS THE US.",f0mk2j7,t3_d5brc9,1568746768,1568771968.0,/r/CanadianInvestor/comments/d5brc9/best_canadian_stocks_or_etf_to_invest_in/f0mk2j7/
108,differing,CanadianInvestor,"HERE’S A THOUGHT EXPERIMENT. SO LET’S SAY APPLE IS TRADING AT $50 A SHARE AND THERE’S 5 BILLION SHARES FLOATING AROUND IN THE MARKET. IF APPLE RELEASED $5 BILLION NEW SHARES, THE PRICE OF THE SHARES SHOULD DROP QUICKLY TO AROUND $25. DID THE COMPANY DROP IN VALUE BY 50%? DID THEY SUDDENLY LOSE OUT ON 50% OF IPHONE SALES? NO, IT’S BECAUSE THE MARKET FOR THE SHARES THEMSELVES WAS ALTERED, NOT THE VALUE OF THE COMPANY. 

HERE’S ANOTHER STORY: BERKSHIRE HATHAWAY A CLASS SHARES ARE WORTH HUNDREDS OF THOUSANDS OF DOLLARS - ONLY WEALTHY PENSION FUNDS AND BILLIONAIRES CAN AFFORD TO INVEST IN THEM. BERKSHIRE HATHAWAY CREATES A NEW CLASS OF CHEAPER SHARES TO INVEST, CURRENTLY AROUND $200 EACH, SO THAT THE COMPANY WOULDN’T BE SOLELY CONTROLLED BY PENSION FUNDS. LOOK AT THE A SHARES AND B SHARES PERFORMANCE, YOU’LL SEE THAT EVEN THOUGH THEY’RE DIFFERENCE PRICES, THE PERFORMANCE (AND PERCENTAGE CHANGE) IS ROUGHLY THE SAME.

THE CURRENT PRICE OF THE SHARES HAS A LOT MORE FACTORS IN IT THAN JUST THE PERFORMANCE OF THE UNDERLYING ASSETS, SO COMPARING THEM SIDE BY SIDE AS AN ABSOLUTE VALUE MAKES NO SENSE. THE PERCENTAGE CHANGE IS A FAR MORE REASONABLE METRIC.",f0kz8m6,t3_d4v5pi,1568692469,1568717669.0,/r/CanadianInvestor/comments/d4v5pi/if_vfv_zsp_and_xus_are_all_tracking_the_sp_500/f0kz8m6/
109,pjulien9,CanadianInvestor,"&GT; I KNOW THAT USD STOCKS ARE TAXED AT 15% INSIDE A TFSA. WHAT ARE SOME STRATEGIES THAT I CAN USE TO OWN USD BASED DIVIDEND STOCKS AND AVOID PAYING A BIG PORTION OF MY RETURN ON TAXES AND FEES. 

&AMP;#X200B;

SO IN 2009, YOU WOULD HAVE AVOIDED BUYING SAY APPLE IN YOUR TFSA BECAUSE OF THE WITHHOLDING TAXES?  WITH SPLITS, ITS ONLY MADE ABOUT 1400%.  YOU REALLY THINK THAT MAKES SENSE?  TAXES ARE DUE ON WITHDRAWAL ON RESP AND RRSPS, I GUESS YOU'RE NOT GOING TO USE THOSE EITHER THEN?  CANADIAN LISTED ETFS WILL HAVE WITHHOLDING TAXES ON THEM TOO, ARE THOSE ALSO OUT OF SCOPE?

SERIOUSLY, YOU CAN AVOID WITHHOLDING TAXES LIKE SO:

* IN AN RRSP OR RRIF, US STOCKS AND US LISTED ETFS THAT ONLY OWN US STOCKS WILL NOT HAVE ANY WITHHOLDING
* IN A TAXABLE ACCOUNT, CAN CLAIM THE FOREIGN TAX CREDIT TO CLAW BACK THE WITHHOLDING

&AMP;#X200B;

&GT; IF I DON’T HOLD THESE IN A REGISTERED ACCOUNT WHAT KIND OF TAXES/FEES WOULD I END UP PAYING IN ADDITION TO CAPITAL GAINS AND DIVIDENDS. I WANT TO HOLD THEM IN USD AND RECEIVE MY DIVIDENDS IN USD TO REINVEST. 

&AMP;#X200B;

THE FOLLOWING TAXATION LEVELS NEED TO BE CONSIDERED:

* IT'S 15% OF THE DISTRIBUTION, IF THE STOCK PAYS 2%, IT'S 15% OF THAT 2% TO THE IRS.  YOUR BROKER WILL TAKE CARE OF THIS.
* THE REST OF THE DISTRIBUTION IS CONSIDERED INCOME, NO MATTER WHAT THE CHARACTERISTIC OF THE DISTRIBUTION IS.  THIS MEANS EVEN RETURN ON CAPITAL (ROC) AND CAPITAL GAIN DISTRIBUTIONS BECOME FOREIGN INCOME.  THIS IS TAXED THE YEAR YOU RECEIVE IT AT YOUR MARGINAL RATE.  THIS MEANS ACB IS UNCHANGED FROM ROC DISTRIBUTIONS ON FOREIGN SECURITIES.
* US DOLLARS ARE CAPITAL PROPERTY.  CAPITAL GAINS/LOSSES ARE APPLICABLE WHENEVER [THEY'RE SOLD](HTTPS://WWW.ADJUSTEDCOSTBASE.CA/BLOG/CALCULATING-ADJUSTED-COST-BASE-WITH-FOREIGN-CURRENCY-TRANSACTIONS/).
* WHEN SELLING THE STOCKS, CAN REPORT CAPITAL GAINS AND LOSSES ON THEM.  MUST ALWAYS BE REPORTED IN CANADIAN DOLLARS.
* IF RECEIVING ROC.  CAN FILE WITH THE IRS THE FOLLOWING YEAR TO GET THE MONEY WITHHELD BACK.  IT'S STILL FOREIGN INCOME IN CANADA THOUGH, ROC DOLLARS RETRIEVED FROM THE IRS WILL STILL BE TAXED AT YOUR MARGINAL RATE.
* IF YOU OWN OVER 60K OF US PROPERTY AT DEATH, THIS DOES NOT INCLUDE CAD LISTED ETFS THAT OWN US STOCKS, YOUR ESTATE WILL OWE TAXES TO THE IRS.  THE FOREIGN INCOME TAX CREDIT APPLIES IN THIS GRIMLY SCENARIO ALSO.",f0je3fx,t3_d537tj,1568654753,1568679953.0,/r/CanadianInvestor/comments/d537tj/usd_dividend_stocks/f0je3fx/
110,Shaun80,CanadianInvestor,DUDE THE NASDAQ AND MOST OF ITS COMPONENTS ARE  JUST SHY OF ALL TIME HIGH WHAT ARE YOU TALKING ABOUT.  APPLE WENT UP 3 PERCENT YESTERDAY AND MASTERCARD 2.5 PERCENT TODAY. SHOPIFY HAS REBOUNDED LIKE 10 PERCENT IN THE LAST TWO DAYS. ITS HARD TO PROCLAIM SMART MONEY IS MOVING AFTER A TWO DAY SELL OFF. LETS WAIT FOR AT LEAST A WEEK OR TWO BEFORE WE CAN MAKE THAT JUDGEMENT.,f033f5p,t3_d2zlgq,1568343795,1568368995.0,/r/CanadianInvestor/comments/d2zlgq/stock_market_back_on_track/f033f5p/
111,Smokiiz,CanadianInvestor,MY OLD FINANCE TEACHER FROM COLLEGE BOUGHT IN AT $30 IN 2011 THINKING THAT BB WOULD BE THE NEXT APPLE ONE DAY. SHE’S PROBABLY STILL HOLDING THIS DAMN STOCK.,ezrk5e6,t3_d1qs8o,1568075032,1568100232.0,/r/CanadianInvestor/comments/d1qs8o/what_are_everyones_opinions_on_bb_at_the_moment/ezrk5e6/
112,Matthaus_2000,CanadianInvestor,"A POWERFUL LAPTOP THAT CAN LAST 4 YEARS OF UNIVERSITY. 

NOT THE FANCY APPLE CRAPS, NOR THE GAMING LAPTOP WITH A MOBILE NVIDIA 1060.

NOT UNTIL I STARTED MY 4TH YEAR THESIS/GRADUATION PROJECT I DIDN'T HOW A GOOD LAPTOP MAKES A DIFFERENCE.",eznd898,t3_d1lc6m,1568004238,1568029438.0,/r/CanadianInvestor/comments/d1lc6m/investing_under_18/eznd898/
113,Matthaus_2000,CanadianInvestor,"I USE QUESTRADE. EXCHANGE VIA [DLR.](HTTPS://DLR.TO)TO AND DLR.U

MY SUGGESTION IS THAT IF YOU DON'T HAVE $60K, $70K SAVED UP, AND ALL THE TIME IN THE WORLD BETWEEN 7:30 AM - 9:00 AM, IT DOESN'T WORTH THE HASSLE.

IF I WERE TO START ALL OVER AGAIN, I WOULD HAVE JUST PICKED XEC, XEF, VFV, VCN... THEN GO TO THE GYM EVERYDAY ETC. HEALTH AND HAPPINESS ARE IMPORTANT. I HAVE A NEW WRX PARKED OUTSIDE. I DRIVE IT ONLY 200 KM/WEEK, 11,000 KM LAST YEAR. I BOUGHT IT TO GO ON ROADTRIPS BUT NEVER HAPPEN IN THE PAST 2.5 YEARS. 

ANYWAY, THIS IS HOW I DID IT:

TFSA - CANADA: ENB ($38), IPL ($19), SU (IN &AMP; OUT A FEW TIMES &AMP; NOW FREE), BNS ($74), EMA ($39), FTS ($41), MG ($59)... ALL THE USUAL'S

TFSA - ZAG (CASH RESERVE)

RRSP - US: DLR.U &AMP; [DLR.TO](HTTPS://DLR.TO) (CASH HOLDINGS), XOM ($74), WFC ($45), WBA ($50), GM ($36), T ($32)

RRSP - DEVELOPED: ZEA (AVG $17.7)

RRSP - DEVELOPING: ZEM (AVG $18.5)

&AMP;#X200B;

MY PORT IS SKEWED TOWARDS: OIL, ENERGY, UTILITIES, FINANCIALS AND CARS... I WISH TO ADD SOME MORE PHAM/TECH/CONSUMER'S: JNJ, ABBV/ABT, RED HAT, APPLE, PG",ezi5hbj,t3_d1611c,1567921576,1567946776.0,/r/CanadianInvestor/comments/d1611c/dividend_growth_investing/ezi5hbj/
114,SillyPutty47,CanadianInvestor,"IT'S BEATEN THE MARKET BUT THERE IS A LOT OF SURVIVORSHIP BIAS SO IT'S HARD TO SAY HOW WELL IT WILL PERFORM IN THE FUTURE. IT WASN'T LONG AGO THAT EVERY WHITE GIRL HAD A BLACKBERRY SMARTPHONE AND WORE BENCH JACKETS. ALSO, APPLE HAS PERFORMED VERY WELL OVER THE LAST TEN YEARS. ANY INDEX THAT INCLUDES APPLE WILL PROBABLY BEAT THE S&AMP;P.",eyvzcv3,t3_cyxcza,1567516651,1567541851.0,/r/CanadianInvestor/comments/cyxcza/white_girl_index_but_on_the_tsx/eyvzcv3/
115,ter_eh,CanadianInvestor,"DO APPLE PAY OR SAMSUNG PAY OFFER CREDIT?
BECAUSE THAT IS THE DISRUPTOR TO BIG CC COMPANIES IF THEY DO. 
APPLE AND SAMSUNG PAY ARE MORE DISRUPTIVE TO INTERAC IF I UNDERSTAND THE BUSINESS WELL ENOUGH.",eykzxaz,t3_cxclgt,1567172754,1567197954.0,/r/CanadianInvestor/comments/cxclgt/consolidating_portfolio/eykzxaz/
116,theprimer26,CanadianInvestor,"LOTS OF PEOPLE COME OUT OF SCHOOL IN GOOD SHAPE.  PART TIME AND SUMMER JOBS THROUGH HIGH SCHOOL.  PART TIME JOB AND PAID INTERNSHIPS THROUGH POST SECONDARY.  IF THAT MONEY IS PUT ASIDE WITH DISCIPLINE AND GOALS IN MIND, IT REALLY ADDS UP.  GET ASSISTANCE FROM YOUR PARENTS AND/OR STAY AT HOME FOR POST SECONDARY AND YOU'RE EVEN FURTHER AHEAD.

MINIMUM 100 SHARE ORDERS?  WHERE DID YOU LEARN THIS?  WHAT IF YOU'RE COMPARING PENNY STOCKS TO APPLE?  THE ONLY THING THEY SHOULD BE CONCERNED WITH IF INVESTING IN $500 BLOCKS IS GETTING THEIR TRADING COMMISSIONS DOWN (WHICH IT SOUNDS LIKE THEY'RE DOING).",ey37qsj,t3_cv4fjv,1566757496,1566782696.0,/r/CanadianInvestor/comments/cv4fjv/money_to_invest/ey37qsj/
117,aabbccbb,CanadianInvestor,"&GT; I LITERALLY SAID COMPANIES LIKE APPLE...CAN YOU READ?

YES, BUT YOUR CONCERN APPLIES TO LITERALLY ANY COMPANY THAT USES MATERIALS.

THAT'S MOST OF THEM.

AND YET YOU CHOSE TO USE A TECH COMPANY AS YOUR EXAMPLE, LOL.

&GT;  WHEN YOU TAKE YOUR POST ABOVE AND ADD IT TO ALL OF THE OTHER RAMBLING POSTS YOU'VE MADE ON THIS THREAD, IT'S CLEAR YOU'RE A FAR LEFT ENVIRO SHILL WITH NOTHING OF VALUE TO ADD.

AND WHEN I TAKE YOUR POST AND ALL THE COMPLETELY INCOHERENT ARGUMENTS YOU'VE TRIED TO MAKE IN SUPPORT OF IT, IT'S CLEAR THAT YOU'RE JUST ANOTHER ROUGHNECK ""SCIENTIST"" WHO THINKS HE KNOWS BETTER THAN THE WORLD'S ACTUAL SCIENTISTS.

&GT; HAVE A GOOD ONE.

YOU TOO.",expt17g,t3_cto4e1,1566494050,1566519250.0,/r/CanadianInvestor/comments/cto4e1/the_30_billion_exodus_foreign_oil_firms_are/expt17g/
118,closingbell,CanadianInvestor,"&GT; YES, THAT'S EXCLUSIVE TO APPLE, LOL

I LITERALLY SAID COMPANIES LIKE APPLE...CAN YOU READ?

&GT; HAVE YOU HEARD OF ""CLIMATE CHANGE?""

YES, AND IT'S SUCH A BROAD TERM THAT WHEN YOU TAKE YOUR POST ABOVE AND ADD IT TO ALL OF THE OTHER RAMBLING POSTS YOU'VE MADE ON THIS THREAD, IT'S CLEAR YOU'RE A FAR LEFT ENVIRO SHILL WITH NOTHING OF VALUE TO ADD.

HAVE A GOOD ONE.",exppnpk,t3_cto4e1,1566492984,1566518184.0,/r/CanadianInvestor/comments/cto4e1/the_30_billion_exodus_foreign_oil_firms_are/exppnpk/
119,aabbccbb,CanadianInvestor,"&GT; HUGE CARBON FOOTPRINTS (FROM SHIPPING GOODS/MATERIALS)

YES, THAT'S EXCLUSIVE TO APPLE, LOL

&GT; WHY ARE ""SOCIAL AND ENVIRONMENTAL"" IMPACTS ONLY CONSIDERED FOR OIL, AND NOT SO MANY OTHER INDUSTRIES? 

HAVE YOU HEARD OF ""CLIMATE CHANGE?""

&GT; YOU'RE TELLING ME OIL IS NOT NECESSARY? OK...GOOD LUCK.

THANKS!  THE SANE AMONG US ARE LISTENING TO THE SCIENTISTS AND WORKING ON IT.",expof4n,t3_cto4e1,1566492585,1566517785.0,/r/CanadianInvestor/comments/cto4e1/the_30_billion_exodus_foreign_oil_firms_are/expof4n/
120,closingbell,CanadianInvestor,"&GT; AS THOUGH THOSE THINGS SHOULDN'T BE TAKEN INTO CONSIDERATION WHEN INVESTING?

IF PEOPLE TOOK THAT INTO STRONG CONSIDERATION FOR THEIR INVESTMENTS, COMPANIES LIKE APPLE - WITH USING VIRTUALLY SLAVE LABOUR, HUGE CARBON FOOTPRINTS (FROM SHIPPING GOODS/MATERIALS) WOULD BE PLUMMETING AS WE SPEAK.  WHY ARE ""SOCIAL AND ENVIRONMENTAL"" IMPACTS ONLY CONSIDERED FOR OIL, AND NOT SO MANY OTHER INDUSTRIES?  

&GT; YOU MEAN ""DESPERATELY TRYING TO MAKE OIL SEEM VIABLE AND NECESSARY.""

YOU'RE TELLING ME OIL IS NOT NECESSARY?  OK...GOOD LUCK.",exp2r1b,t3_cto4e1,1566485182,1566510382.0,/r/CanadianInvestor/comments/cto4e1/the_30_billion_exodus_foreign_oil_firms_are/exp2r1b/
121,etienner,CanadianInvestor,"IT'S NOT LIKE APPLE HAD THIS CONVERSATION:

HEY! LET'S STOP INNOVATING SO WE CAN BECOME THE NEXT BLACKBERRY",exlsiam,t3_ctik06,1566418604,1566443804.0,/r/CanadianInvestor/comments/ctik06/the_american_disease_canadian_companies_pouring/exlsiam/
122,jugwhatever,CanadianInvestor,"IT SEEMS WEIRD TO SINGLE OUT BUYBACKS. THEY'RE ONE OF A MILLION WAYS THAT A BAD MANAGER CAN MISALLOCATE CAPITAL. AS THE ARTICLE SAYS, EACH SITUATION IS DIFFERENT. 

BLAMING BUYBACKS FOR APPLE HAVING ""STOPPED INNOVATING"" IS QUITE A STRETCH.",exl1w44,t3_ctik06,1566404177,1566429377.0,/r/CanadianInvestor/comments/ctik06/the_american_disease_canadian_companies_pouring/exl1w44/
123,darth6ixious,CanadianInvestor,"THINKING OF BUYING SOME CALLS ON APPLE TOMORROW WITH A 2 MONTH EXPIRY.  DROPPED FROM 219 TO 193. 

BUT TO ANSWER YOUR QUESTION I’VE BOUGHT 1.2 K OF MUTUAL FUNDS IN MY TFSA SINCE FRIDAY . MOSTLY US EQUITIES",ew9cgza,t3_cmre9k,1565223095,1565248295.0,/r/CanadianInvestor/comments/cmre9k/anyone_buying_the_dip_today/ew9cgza/
124,DividendEarner,CanadianInvestor,"THOSE ARE GREAT PICKS. COST IS ALSO GREAT.

MY TOP 4 WINNERS AND ADD APPLE.

ON CANADIAN SIDE CNR AND ATD.B

MY PORTFOLIO IS HERE
HTTPS://WWW.DIVIDENDEARNER.COM/DIVIDEND-STOCKS-PORTFOLIO/",ew63y9a,t3_cmx04i,1565153201,1565178401.0,/r/CanadianInvestor/comments/cmx04i/should_i_diversify_more_or_add_to_my_existing/ew63y9a/
125,Shaun8030,CanadianInvestor,MSFT APPLE VISA MASTERCARD DISNEY SHOP BAM ALL  TOOK A BEATING BOUGHT A BIT MORE RECENTLY WITH THE DROP BUT NO MORE ROOM IN TFSA  . ALL SOLID COMPANIES NOT WORRIED LONG TERM EXCEPT FOR MAYBE SHOP BUT I GOT IN AT A DECENT ENTRY POINT .,ew2rmgg,t3_cmf5nk,1565054120,1565079320.0,/r/CanadianInvestor/comments/cmf5nk/will_we_see_cad_traded_us_index_funds_dip/ew2rmgg/
126,DividendEarner,CanadianInvestor,"APPLE IS MOVING INTO HEALTH RELATED SERVICES. IT WAS MENTIONED BY TIM COOK ON AN INTERVIEW WITH JIM CRAMER IN JANUARY.

THEY DON’T ADVERTISED THEIR NEXT MOVE - THEY ARE GOOD A STEALTH. IT’S NOT BECAUSE YOU CAN’T SEE WHERE THEY ARE GOING THAT THEY DON’T HAVE A PLAN TO GROW AND THEY DON’T HAVE TO SHARE IT.

HOWEVER, 15% IS A LOT. I KEEP MY LARGE HOLDINGS TO 5% ($50K FOR ME).

I AM NOT SURE WHAT YOUR INVESTING STRATEGY AND GOALS ARE. DO YOU HOLD CREDIT CARD STOCKS? IT’S MOSTLY FINTECH.

I RECENTLY BOUGHT A TINY POSITION IN IGV ETF TO GET EXPOSURE TO SOME SOFTWARE STOCKS.",evo43hv,t3_cjbm6e,1564638107,1564663307.0,/r/CanadianInvestor/comments/cjbm6e/aapl_keep_or_sell/evo43hv/
127,cognitiveinertia,CanadianInvestor,I’M NEW BUT I WOULD SAY I AGREE. I DON’T SEE ANY COMPETITOR STEPPING UP TO APPLE OR SAMSUNG YET. THE ECOSYSTEMS REMAIN THE MOAT IN MY OPINION.,evistnh,t3_cjbm6e,1564548590,1564573790.0,/r/CanadianInvestor/comments/cjbm6e/aapl_keep_or_sell/evistnh/
128,Shaun8030,CanadianInvestor,HOPE YOU DIDN'T SELL UP 5 PERCENT AFTER HOUR. APPLE IS A GREAT LONG HOLD.,evhn3sw,t3_cjbm6e,1564529007,1564554207.0,/r/CanadianInvestor/comments/cjbm6e/aapl_keep_or_sell/evhn3sw/
129,Shaun8030,CanadianInvestor,NOT A BAD OPTION . THAT WOULD BE MY 5TH CHOICE AFTER APPLE VISA MASTERCARD AND MICROSOFT,evcu5hf,t3_cjeaow,1564423333,1564448533.0,/r/CanadianInvestor/comments/cjeaow/favorite_blue_chip_stock/evcu5hf/
