,author,subreddit,body,id,link_id,created_utc,created,permalink
130,Shaun8030,CanadianInvestor,APPLE VISA MASTERCARD MICROSOFT,evctv2g,t3_cjd8d5,1564423151,1564448351.0,/r/CanadianInvestor/comments/cjd8d5/high_risk_plays/evctv2g/
131,piratefreedom,CanadianInvestor,"15% IN ANY INDIVIDUAL STOCK IS TOO MUCH. EVEN A GREAT COMPANY LIKE APPLE. 
VGT WOULD BE BETTER AND HAS APPLE AS ITS 2ND LARGEST HOLDING ANYWAY (AFTER MS).",evcgwna,t3_cjbm6e,1564414950,1564440150.0,/r/CanadianInvestor/comments/cjbm6e/aapl_keep_or_sell/evcgwna/
132,ShaidarHaran2,CanadianInvestor,"I SUSPECT THERE WILL BE PLENTY OF DIPS TO BUY INTO UNTIL 2020, WHICH SHOULD BE MORE OF A SUPERCYCLE, WITH 5G, 5NM, USB C, PROMOTION, ETC. THE 2019 PHONES ARE LOOKING LIKE SNOOZERS. SURE THEY'RE SCALING UP THEIR SERVICES REVENUE, BUT IPHONES ARE STILL BY FAR THE LIONS SHARE OF REVENUE. 


I'D STILL BE CONTENT TO HOLD APPLE FOR YEARS, BUT DON'T BE AFRAID OF TAKING PROFITS HERE EITHER.",evccwjx,t3_cjbm6e,1564412270,1564437470.0,/r/CanadianInvestor/comments/cjbm6e/aapl_keep_or_sell/evccwjx/
133,ShaidarHaran2,CanadianInvestor,"FOR TRADE? PRETTY GOOD, IT WAS VERY TECH HEAVY AS I SAID, I WENT SOXX AND QQC.F (QQQ IN CANADIAN DOLLARS) AS THE BASIS, MICROSOFT, XILINX, APPLE, NVIDIA, MONGODB, AND AMD AS INDIVIDUAL PICKS ALL WENT PRETTY WELL. IT'S HARD TO SAY HOW MUCH THEY BEAT THE MARKET/REGULAR WEALTHSIMPLE SINCE I EXITED AND ENTERED A FEW TIMES, BUT FOR EXAMPLE XILINX WAS UP 63% ON THE YEAR, APPLE FROM THE LOWS WAS 30%, ETC. 

I DID HAVE DUD PICKS TOO, LARGELY CANADIAN OIL STOCKS THAT I THOUGHT WERE CHEAP ENOUGH SOMETHING LIKE A YEAR AGO ONLY TO HAVE THEM FALL ANOTHER 30-50%, BUT THE WINNERS MORE THAN MADE THAT UP. IF THESE EVER BREAK EVEN I'LL PROBABLY JUST LEAVE THAT SECTOR FOR GOOD.",evapk1s,t3_cix4an,1564353765,1564378965.0,/r/CanadianInvestor/comments/cix4an/thoughts_on_ws_allocations_consider_transfer_to/evapk1s/
134,Shaun8030,CanadianInvestor,"BE PATIENT NEXT DIP HOPEFULLY LIKE DECEMBER  PICK UP APPLE , MICROSOFT , VISA , MASTERCARD , DISNEY , BAM AND SHOPIFY AND THEN HOLD LONG TERM.",ev9iuku,t3_cindev,1564322977,1564348177.0,/r/CanadianInvestor/comments/cindev/pure_canadian_bank_stocks_portfolio/ev9iuku/
135,jmho19,CanadianInvestor,"ID SAY I’M PRETTY AVERAGE, HAVE A CAR LOAN, MORTGAGE LOAN, SECOND MORTGAGE LOAN, CREDIT CARD INTEREST, LIFE, HOME, AUTO INSURANCE.. YOU KNOW ALL THE NORMAL AVERAGE STUFF THAT THE NORMAL AVERAGE PERSON WORKS TO PAY FOR..  AND I’M OVER 18 BUT I’D RECOMMEND TO ANY 18 YEAR OLD NOT TO GET A FB CREDIT CARD AND TO GET ONE FROM THEIR BANK BECAUSE WHEN THEY HAVE A PROBLEM WITH THEIR STATEMENTS AND THEY WILL HAVE A PROBLEM WITH THEIR STATEMENTS.. THEY CAN GO TO THE LOCAL BRANCH AND GET IMMEDIATE HELP AND THEY CAN ALSO GET OVER LIMIT  FEES REDUCED/WIPED BECAUSE BANKS HAVE BETTER CUSTOMER SERVICE AND SHOW CUSTOMER APPRECIATION/KNOW YOUR CONTINUOUS MONTHLY INTEREST PAYMENTS AND ALL OF YOUR COMBINED LOANS AND CREDIT FEES IS WORTH MORE OVER A LIFE TIME THAN A $20 OVER LIMIT FEE  COMPARED TO FB WHO YOU WOULD CALL AND WAIT ON A PHONE LINE WITH ELEVATOR MUSIC FOR 2 HOURS ONLY TO TALK TO SOMEONE WHO WOULD DO NOTHING FOR YOU..  BANKS GIVE THEIR CUSTOMERS MORE LEVERAGE THEN A FB OR AN APPLE.. I CAN’T GO INTO APPLE AND SAY THIS MACBOOK IS 1200? ILL GIVE YOU 1000 FOR IT... BUT I CAN GO TO MY BANK AND SAY THIS MORTGAGE RATE IS 5% I’LL PAY 3.5% AND THEY’LL USUALLY MAKE IT HAPPEN FOR YOU WITHOUT QUESTION

AND THE ECONOMY CRASHED IN 2009 THE HOUSING MARKET CRASHED END OF 2012 BEGINNING OF 2013",ev93szs,t3_cindev,1564304551,1564329751.0,/r/CanadianInvestor/comments/cindev/pure_canadian_bank_stocks_portfolio/ev93szs/
136,jmho19,CanadianInvestor,"ID SAY I’M PRETTY AVERAGE, HAVE A CAR LOAN, MORTGAGE LOAN, SECOND MORTGAGE LOAN, CREDIT CARD INTEREST, LIFE, HOME, AUTO INSURANCE.. YOU KNOW ALL THE NORMAL AVERAGE STUFF THAT THE NORMAL AVERAGE PERSON WORKS TO PAY FOR..  AND I’M OVER 18 BUT I’D RECOMMEND TO ANY 18 YEAR OLD NOT TO GET A FB CREDIT CARD AND TO GET ONE FROM THEIR BANK BECAUSE WHEN THEY HAVE A PROBLEM WITH THEIR STATEMENTS AND THEY WILL HAVE A PROBLEM WITH THEIR STATEMENTS.. THEY CAN GO TO THE LOCAL BRANCH AND GET IMMEDIATE HELP AND THEY CAN ALSO GET OVER LIMIT  FEES REDUCED/WIPED BECAUSE BANKS HAVE BETTER CUSTOMER SERVICE AND SHOW CUSTOMER APPRECIATION/KNOW YOUR CONTINUOUS MONTHLY INTEREST PAYMENTS AND ALL OF YOUR COMBINED LOANS AND CREDIT FEES IS WORTH MORE OVER A LIFE TIME THAN A $20 OVER LIMIT FEE  COMPARED TO FB WHO YOU WOULD CALL AND WAIT ON A PHONE LINE WITH ELEVATOR MUSIC FOR 2 HOURS ONLY TO TALK TO SOMEONE WHO WOULD DO NOTHING FOR YOU..  BANKS GIVE THEIR CUSTOMERS MORE LEVERAGE THEN A FB OR AN APPLE.. I CAN’T GO INTO APPLE AND SAY THIS MACBOOK IS 1200? ILL GIVE YOU 1000 FOR IT... BUT I CAN GO TO MY BANK AND SAY THIS MORTGAGE RATE IS 5% I’LL PAY 3.5% AND THEY’LL USUALLY MAKE IT HAPPEN FOR YOU WITHOUT QUESTION",ev93ghg,t3_cindev,1564304013,1564329213.0,/r/CanadianInvestor/comments/cindev/pure_canadian_bank_stocks_portfolio/ev93ghg/
137,rshanks,CanadianInvestor,"I WOULDN’T BE SO SURE THAT A TECH COMPANY CAN’T OFFER THIS CONVENIENCE. YOU ARE PROBABLY NOT THE AVERAGE PERSON IF YOU PAY 3/4 OF YOUR SALARY TO THE BANKS.

WHAT IF WHEN YOU TURN 18 YOUR PHONE PROMPTS YOU TO GET THE APPLE / GOOGLE CREDIT CARD? DO YOU DO THAT OR STILL GO TO YOUR BANK?

IMO THE QUESTION ISN’T WILL THE BANKS GO UNDER, IT’S WHAT ARE SOME RISKS THAT THEY UNDERPERFORM THE MARKET.",ev92km1,t3_cindev,1564302685,1564327885.0,/r/CanadianInvestor/comments/cindev/pure_canadian_bank_stocks_portfolio/ev92km1/
138,jmho19,CanadianInvestor,"I HAVE 3 BANKING ACCOUNTS, 4 TRADING ACCOUNTS, 3 LOANS, 1 CREDIT CARD AND 3 INSURANCE POLICIES WITH JUST 1 OF MY BANKS. THEY PRETTY MUCH TAKE 3/4 OF MY SALARY BETWEEN INTEREST, FEES AND COMMISSION SO I DON’T THINK THE 10/MONTH CHECKING ACCOUNT FEE WOULD EVEN BE A NOTICEABLE LOSS IF IT WAS WIPED.. AS YOU CAN SEE MY LIFE IS LOCKED INTO ONE BANK AND THE REASON FOR THIS IS CONVENIENCE.. FB CAN’T OFFER THAT AND BOTH FB AND APPLE HAVE CONTINUOUSLY PROVEN THAT THEY SUCK AT CUSTOMER SERVICE AND HAVE POOR SECURITY SO THEY WILL NEVER TAKE OVER NATIONAL BANKING INSTITUTIONS

AND THE HOUSING MARKET CRASHED IN 2013, BANKS DIDN’T BUDGE.. THE RECESSION IN 2008-9 HIT THE BANKS HARD BUT THEY BOUNCED BACK IN 12 SHORT MONTHS AND NEVER LOOKED BACK",ev924t1,t3_cindev,1564302035,1564327235.0,/r/CanadianInvestor/comments/cindev/pure_canadian_bank_stocks_portfolio/ev924t1/
139,jmho19,CanadianInvestor,"I HAVE 3 BANKING ACCOUNTS, 4 TRADING ACCOUNTS, 3 LOANS, 1 CREDIT CARD AND 3 INSURANCE POLICIES WITH JUST 1 OF MY BANKS. THEY PRETTY MUCH TAKE 3/4 OF MY SALARY BETWEEN INTEREST, FEES AND COMMISSION SO I DON’T THINK THE 10/MONTH CHECKING ACCOUNT FEE WOULD EVEN BE A NOTICEABLE LOSS IF IT WAS WIPED.. AS YOU CAN SEE MY LIFE IS LOCKED INTO ONE BANK AND THE REASON FOR THIS IS CONVENIENCE.. FB CAN’T OFFER THAT AND BOTH FB AND APPLE HAVE CONTINUOUSLY PROVEN THAT THEY SUCK AT CUSTOMER SERVICE AND HAVE POOR SECURITY SO THEY WILL NEVER TAKE OVER NATIONAL BANKING INSTITUTIONS",ev920yx,t3_cindev,1564301878,1564327078.0,/r/CanadianInvestor/comments/cindev/pure_canadian_bank_stocks_portfolio/ev920yx/
140,rshanks,CanadianInvestor,"THESE SCENARIOS ARE POSSIBLE AND WHILE THEY MAY NOT CAUSE THE BANKS TO GO UNDER THEY COULD CERTAINLY MAKE A DENT IN THEIR REVENUE AND THUS (PROBABLY) THEIR STOCK PRICE.

1. THEY DONT HAVE TO REPLACE BANKS OR CAD, BUT WHAT HAPPENS IF THEY START TO TAKE A BITE OUT OF BANK REVENUE? WHAT IF IT IS EASIER TO KEEP MONEY IN AN APPLE (OR WHOEVER) WALLET VS A CHECKING ACCOUNT? IMO THIS IS SOMETHING THE BANKS NEED TO BE CAREFUL OF.
2. I WOULDN'T SAY IT CRASHED, MAYBE STAGNATED FOR A BIT. THERE IS A BIG DIFFERENCE IN THAT PRICE STAGNATION DOESNT PUT PEOPLE UNDER WATER.ACTIVE INVESTMENT?
3. I WOULDN'T SAY IT CRASHED, MAYBE STAGNATED FOR A BIT. IF YOUR HOUSE PRICE STAGNATED, YOU PROBABLY WOUDNT WALK AWAY FROM IT. IF I WAS SIGNIFICANTLY UNDERWATER, IT MIGHT BE TEMPTING.",ev916gh,t3_cindev,1564300625,1564325825.0,/r/CanadianInvestor/comments/cindev/pure_canadian_bank_stocks_portfolio/ev916gh/
141,jmho19,CanadianInvestor,"1) YOU DON'T ACTUALLY THINK APPLE AND FACEBOOK ARE GOING TO REPLACE BANKS DO YOU??  IS FB GOING TO BECOME THE NEW BANK OF CANADA? OR IS THE FB LIBRA COIN JUST GOING TO REPLACE THE CANADIAN DOLLAR? IF FB DOES NOT TAKE OVER THE BANK OF CANADA I DON'T KNOW HOW I WILL FEEL ABOUT CONVERTING MY LIBRA INTO CAD DOLLARS FOR A DIFFERENT EXCHANGE RATE EVERY SINGLE TIME I WANT TO PURCHASE SOMETHING... OH WAIT I GET IT!! FB WILL BE THE BOC AND APPLE WILL BE THE RETAIL BANKS!! TWO AMERICAN COMPANIES PARTNERING UP TO TAKE OVER CANADA AND BECOME THE NEW MONETARY AUTHORITY LOL

2) THE DAY THOSE EXPENSIVE INVESTMENT BANKERS ARE OUT OF A JOB IS THE DAY THE STOCK MARKET CLOSES FOR GOOD ALONG WITH EVERY PUBLICLY TRADED COMPANY IN IT AND CANADA BECOMES A 3RD WORLD COUNTRY

3) CANADIAN HOUSING MARKET DID CRASH 6 YEARS AGO... THE BANKS DIDN'T RISE BUT THEY ALSO DIDN'T FALL

4) PLEASE DON'T BE OFFENDED WHEN I SAY THIS IS PROBABLY THE DUMBEST POST I HAVE EVER READ ON THIS SITE BECAUSE IT WAS ALSO KIND OF FUNNY..  HOWEVER, OUR WORLD IS EVOLVING QUICKLY AND WITH TODAYS TECHNOLOGY IT ISN'T THAT FARFETCH TO IMAGINE A WORLD WHERE MAJORITY OF BUSINESS AND CONSUMER TRANSACTION ARE ALL DONE  OVER THE WORLD WIDE WEB WITH FB , APPLE AND TESLA ALL BECOMING THEIR OWN GOVERNED  COUNTRIES ON PLANET MARS.. SO EVEN THOUGH YOU GET THE CREDIT FOR CREATING THE DUMBEST POST I HAVE EVER READ ON REDDIT, I DO NOT THINK THAT YOU ARE A STUPID PERSON AND I AM VERY INTRIGUED BY YOUR IMAGINATION",ev8ud9o,t3_cindev,1564291904,1564317104.0,/r/CanadianInvestor/comments/cindev/pure_canadian_bank_stocks_portfolio/ev8ud9o/
142,Matthaus_2000,CanadianInvestor,"INNOVATION WOULD ONLY WORK IF INTELLECTUAL PROPERTY LAWS ARE BEING ENFORCED. 

IN OUR WORLD, QCOM CAN SUE APPLE'S ASS EVEN THOUGH APPLE HAS 10 TIMES THE MARKET CAP OF QCOM, SO DID SAMSUNG AND APPLE GO AFTER EACH OTHER.

IN CHINA, ALL YOU NEED TO IS GO STRAIGHT INTO THE OTHER GUYS OFFICE OR HACK INTO THEIR SYSTEM AND STEAL IT. INDUSTRIAL ESPIONAGE IS A FAIR GAME, NOT ONLY CHINA STEALING FROM US, BUT CHINESE STEALING AMONG EACH OTHER. 

I REMEMBER I WAS READING AN ARTICLE FROM A SMALL TIME APP DEVELOPER, HE WAS SAYING WHEN ALIBABA WAS DEVELOPING THEIR OWN APP FOR CELLPHONES, THE GUYS AT ALIBABA VISITED THEIR OFFICE AND TALKED ABOUT ACQUISITION (GOOD NEWS, RIGHT?). HE'S GOT GHOSTED AND 6 MONTHS LATER WHATEVER HIS SMALL TEAM WAS WORKING ON ENDED UP BEING PART OF ALIBABA'S APP'S FUNCTION. 

TECH AND INNOVATION ARE LIKE DEMOCRACY... WE CAN ALL VOTE FOR OUR FAVORITE PRIME MINISTER CANDIDATE. ALBERTA HATE JUSTIN TRUDEAU, BUT YOU WOULDN'T SEE A RED NECK GOING AFTER HIM IN A SUICIDE VEST AT STAMPEDE SO THAT WE CAN ALL HAVE A NEW PM, RIGHT?",ev6836i,t3_ci38vi,1564243667,1564268867.0,/r/CanadianInvestor/comments/ci38vi/an_etf_that_tracks_the_new_chinese_nasdaq/ev6836i/
143,Shaun8030,CanadianInvestor,WHY DIDN'T YOU WAIT FOR THE NEXT DIP LIKE IN DECEMBER AND THEN DIVIDE 45K BETWEEN  MICROSOFT VISA APPLE MASTERCARD,euyt4oe,t3_cho97t,1564107969,1564133169.0,/r/CanadianInvestor/comments/cho97t/buy_the_enbridge_enb_dip/euyt4oe/
144,Shaun8030,CanadianInvestor,WEED STOCKS ARE SPECULATIVE . GOOD GROWTH COMPANIES  APPLE MICROSOFT VISA MASTERCARD ETC,eu1qieo,t3_ce352q,1563373045,1563398245.0,/r/CanadianInvestor/comments/ce352q/dividend_growth_stocks_with_increasing_dividends/eu1qieo/
145,piermicha,CanadianInvestor,AND MAYBE IF YOU ARE AN INDUSTRY INSIDER YOU CAN MAKE THE RIGHT PICKS. BUT IT'S KIND OF LIKE BEING A TECH INVESTOR IN THE 1980'S - YOU HAVE A SLIM CHANCE OF PICKING APPLE AND NOT THE DOZENS OF PROMISING COMPANIES THAT ULTIMATELY FAILED.,etn0bq3,t3_cbzk5y,1562973228,1562998428.0,/r/CanadianInvestor/comments/cbzk5y/canntrust_sold_illegal_cannabis/etn0bq3/
146,Shaun8030,CanadianInvestor,HOW WILL SELLING SHARES OF THE COMPANY IN YOUR TFSA AFFECT DIVIDEND WITHOLDING TAX IF THESE COMPANIES OTHER THEN APPLE DON'T EVEN PAY OUT A DIVIDEND . NO DIVIDEND EQUALS NO DIVIDEND WITHOLDING TAX,et68rgz,t3_ca5tah,1562506947,1562532147.0,/r/CanadianInvestor/comments/ca5tah/whats_the_best_account_to_hold_us_stocks_in_hate/et68rgz/
147,DonArcher007,CanadianInvestor,"I THINK MOST, IF NOT ALL, BROKERAGES HAVE BOTH A US &AMP; A CDN SIDE TO THEIR ACCOUNTS, SO YOU AREN’T GOING TO GET SCALPED AT ALL WITH THAT PROCESS.       

SO, FOR EX. I’M WITH TD DISCOUNT.    MY RSP ACCOUNT NUMBER IS 123456 .   IT HAS 2 PARTS:  123456S AND 123456U .    THE S PART IS CDN &AMP; THE U PART IS US.   IT’S ONE OVERALL RSP WITH 2 DIFFERENT SEGMENTS.      SO WHEN I WANT  TO BUY AND SELL US STOCKS, I DO IT IN THE U PART OF THE ACCOUNT.   THAT IS A US DOLLAR RSP ACCOUNT AND IT ALWAYS IS IN US DOLLARS .    NO CONVERSIONS, NO FOREIGN EXCHANGE FEES.     I BUY APPLE TODAY, SELL IT TOMORROW, THEN BUY GOOGLE, THEN SELL IT , THEN SIT IN CASH FOR A WHILE THEN BUY GM ETC ETC .   ALL THE TIME I HAVE BEEN IN US DOLLARS .         THE ONLY TIME THERE IS EVER A FX IS WHEN I GO BETWEEN U &AMP; S ACCOUNT, &AMP; I CAN DO NORBERTS GAMBIT FOR THAT.          NON REGISTERED, TFSA ETC ALL WORK THE SAME WAY.",et225bu,t3_c8tjiv,1562409269,1562434469.0,/r/CanadianInvestor/comments/c8tjiv/as_a_canadian_how_should_i_invest_in_american/et225bu/
148,DonArcher007,CanadianInvestor,"NO, THE TFSA IS NOT THE  PLACE FOR US DIVIDEND PAYING STOCKS, BECAUSE THE DIVIDENDS ARE SUBJECT TO THE WITHHOLDING TAX, &AMP; THERE IS NO WAY TO RECAPTURE IT VIA TAX CREDIT.    US DIVIDEND PAYERS IN RSP,         NON DIVIDEND US STOCKS ARE GREAT IN TFSA (GOOGLE, BERKSHIRE, ETC) &AMP; CDN STOCKS. 

HAVING SAID ALL THAT, NOT EVERYONE HAS A BIG RSP, PLUS BIG TFSA, PLUS BIG NON REGISTERED.      IF YOU ONLY HAVE A TFSA AND YOU ARE STARTING OUT, YOU ARE BETTER TO OWN APPLE, FOR EXAMPLE, IN YOUR TFSA AND HAVE THE 15% DIVIDEND NONRESIDENT TAX LOST RATHER THAN NOT OWN APPLE BECAUSE YOU ONLY HAVE A TFSA. ( APP,E BEING AN EXAMPLE IF YOU ARE KEEN TO OWN IT) .      IN A PERFECT WORLD, APPLE GOES INTO YOUR RSP , BUT THE WORLD ISN’T PERFECT.      MY SON, WHO IS 20, ONLY HAS DISNEY &AMP; APPLE , BOTH IN HIS TFSA ....WORKED OUT GOOD FOR HIM",esrrre5,t3_c8tjiv,1562234592,1562259792.0,/r/CanadianInvestor/comments/c8tjiv/as_a_canadian_how_should_i_invest_in_american/esrrre5/
149,MrSkare,CanadianInvestor,"HOLDING. I GOT IN VERY EARLY AND I'VE SEEN SOME INCREDIBLE GAINS AND, TBH, I STILL FEEL LIKE WE HAVEN'T HIT THE CEILING YET.I'VE BEEN INVESTED FOR CLOSE TO TWO YEARS SO I'D LIKE TO SEE WHAT CAN HAPPEN IN ANOTHER 1-2. 

THAT BEING SAID, I AM VERY AWARE THAT THIS WILL NOT LAST. THE LIKELIHOOD OF ONE OF THESE COMPANIES BEING THE NEXT APPLE OR TESLA OF THE CANNABIS INDUSTRY IS PRETTY LOW SO I DO FEEL SOME PRESSURE TO TIME MY EXIT RIGHT.",esogyf4,t3_c8oj5h,1562167366,1562192566.0,/r/CanadianInvestor/comments/c8oj5h/weed_stocks_hype_dead/esogyf4/
150,Shaun8030,CanadianInvestor,"I WOULD GO WITH VGT OVER QQQ IF YOU CAN HANDLE RISK , IT IS THE VANGUARD INFO TECH INDEX IT HAS OUTPERFORMED QQQ LAST 5 YEARS IT'S  PURE INFO TECH UNLIKE THE NASDAQ 100 WHICH CONTAINS NON TECH STOCKS , ALSO VGT CONTAINS STOCKS FROM THE NASDAQ AND NYSE . THE TOP HOLDINGS ARE SOLID WITH ROOM TO GROW I THINK APPLE , MICROSOFT , VISA , MASTERCARD , CISCO,INTEL SALESFORCE , PAYPAL ,BROADCOM,QUALCOMM ARE THE TOP HOLDINGS. RESEARCH INTO IT. I OWN IT AND IT HAS PERFORMED VERY WELL .",ervnfcf,t3_c46mu2,1561320297,1561345497.0,/r/CanadianInvestor/comments/c46mu2/stocks_to_buy_anytime/ervnfcf/
151,productivehype,CanadianInvestor,"RIGHT NOW I PERSONALLY LIKE AMAZON, APPLE, AMD, BOEING, VISA, MCDONALDS, RESTAURANT BRANDS INTERNATIONAL, AND BERKSHIRE HATHAWAY",erv0fjw,t3_c3uhld,1561302890,1561328090.0,/r/CanadianInvestor/comments/c3uhld/approx_5k_in_a_self_directed_rrsp_would_like_to/erv0fjw/
152,nassauboy9,CanadianInvestor,A FEW WEEKS BACK TOOK APPLE ON THE BIG DIP.,eruq29z,t3_c3uhld,1561293069,1561318269.0,/r/CanadianInvestor/comments/c3uhld/approx_5k_in_a_self_directed_rrsp_would_like_to/eruq29z/
153,ShaidarHaran2,CanadianInvestor,"COOL, RIGHT NOW I'M DIGGING XILINX, NVIDIA, NEXTERA ENERGY TO NAME A FEW. APPLE AND MICROSOFT I BELIEVE IN BUT THEY'VE HAD QUITE A RUN RECENTLY, I'D BUY MORE APPLE UNDER 190 AND MORE MICROSOFT UNDER 130.",ertd4r5,t3_c3uhld,1561239027,1561264227.0,/r/CanadianInvestor/comments/c3uhld/approx_5k_in_a_self_directed_rrsp_would_like_to/ertd4r5/
154,BuckNasty1616,CanadianInvestor,"HOW CAN YOU BELIEVE WHAT YOU ARE SAYING FOR #2. ""LITTLE REASON TO ASSUME THIS WILL CONTINUE?""

MICROSOFT, APPLE, GOOGLE, AMAZON, NETFLIX ETC. THESE COMPANIES COULD HAVE BECOME BIG ANYWHERE, JUST A COINCIDENCE IT HAPPENED IN THE US RIGHT? OR MAYBE THE US HAS SOMETHING GOING FOR IT.",erg69kt,t3_c1unoj,1560827695,1560852895.0,/r/CanadianInvestor/comments/c1unoj/please_critique_my_etf_portfolio_xum_xdiv_xec_zlb/erg69kt/
155,svanegmond,CanadianInvestor,"THEY SHOULD BE SCARED. IT’S A GOOD PLAN. 

DAMN APPLE AND THEIR CARELESS CHOICES. MY OS CHEWS UP A GIG OF ‘SYSTEM SERVICES’ EVERY MONTH AND THE ONLY WAY TO STOP IT IS TO KILL ALL INTERNET. 
I JUST LEFT TELUS AND SWITCHED TO VIRGIN, MAINLY BECAUSE “ROAMING” IS BS AND WE ARE FREQUENTLY OUT OF TOWN.",er5xrbz,t3_c08dih,1560535670,1560560870.0,/r/CanadianInvestor/comments/c08dih/telecom_sell_off/er5xrbz/
156,YuriTheRussianBot,CanadianInvestor,"APPLE. 

BOUGHT IT IN 2005 AND DOUBLED THE MONEY AND SOLD IT IN 2007.

IF I WAS TO HOLD ON TO IT, I'D ENJOY 20X RETURN :(",eoa5wl8,t3_br4rbm,1558408065,1558433265.0,/r/CanadianInvestor/comments/br4rbm/you_had_it_you_sold_it_forever_to_haunt_you_one/eoa5wl8/
157,svanegmond,CanadianInvestor,"IF YOU THINK ""25% TARIFFS ON EVERYTHING"" AND ""EVERYTHING THAT LEAVES THIS COUNTRY IS GETTING MORE EXPENSIVE FOR YOU"" AND MAKING AN EXAMPLE OF CERTAIN CANADIAN AGRICULTURE INDUSTRIES ARE SIGNFICANT MEANINGFUL ACTIONS, AND YOU SHOULD, YOU WOULD NOT BE INVESTING IN PEOPLE WHO RELY ON CHINA FOR THEIR SUPPLY CHAIN WHICH IS ONLY THE LARGER PLAYERS SO THIS WOULD MEAN AVOIDING INDICES AS WELL. 

THIS ALSO CAN ONLY BE GOOD NEWS FOR THE PRICE OF MATERIALS

I REALLY HAVE TO TAKE A HARD LOOK AT MY APPLE POSITION.",ende7id,t3_bo5oer,1557781552,1557806752.0,/r/CanadianInvestor/comments/bo5oer/stocks_are_crashing_today/ende7id/
158,Shaun8030,CanadianInvestor,GOOGLE AND APPLE PAY IS ALREADY BEING UTILIZED BY MANY PEOPLE,emm91on,t3_bkg3nq,1557116101,1557141301.0,/r/CanadianInvestor/comments/bkg3nq/100_percent_american_portfolio_longterm/emm91on/
159,SheaButterShea,CanadianInvestor,"EVEN 20 / 80 SPLIT. VCN / XAW

WE HAVE SOME ADVANTAGES INVESTING IN OUR OWN COUNTRY LIKE DIVIDENDS. 

US HAS MORE GROWTH. AND MORE TECH. PEOPLE LIKE THE US BECAUSE IT HAS OUTPERFORMED ANY OTHER COUNTRY IN THE PAST 20 YEARS. WITH APPLE, GOOGLE, AMAZON AND SUCH IT WILL CONTINUE TO.",emm3aik,t3_av70zn,1557112154,1557137354.0,/r/CanadianInvestor/comments/av70zn/thoughts_on_veqt_etf/emm3aik/
160,LostInAntiquity,CanadianInvestor,"I DON’T BELIEVE IN THE ONLINE BANKING DOMINANCE OF APPLE AND GOOGLE. FROM A BASIC SECURITY STANDPOINT, I WOULD NOT LET THOSE COMPANIES TOUCH ANYTHING HAVING TO DO WITH MY FINANCES. THEY ARE UNREGULATED FOR-PROFIT CORPORATIONS, AND WE’VE ALREADY WITNESSED SECURITY BREACHES FROM BOTH.  IF YOU ASK THE AVERAGE CONSUMER, WHILE USING A GOOGLE APP TO BANK MIGHT BE CONVENIENT FOR BUYING STUFF, I DO NOT FORESEE THE AVERAGE JOE SWITCHING FROM THE RBCS AND TDS ANY TIME SOON.",emm2q35,t3_bkg3nq,1557111804,1557137004.0,/r/CanadianInvestor/comments/bkg3nq/100_percent_american_portfolio_longterm/emm2q35/
161,Shaun8030,CanadianInvestor,CAN I ASK YOU WHY YOU FEEL CONFIDENT IN BANKING AND UILITIES? BANKING ONLINE WILL TAKE A HIT ONCE GOOGLE AND APPLE MOVE INTO THE SECTOR AS THEY HAVE ALREADY MADE IT PART OF THEIR PLAN. UTILITIES DO YOU SEE POPULATION GROWTH AND ELECTRIC CARS  DRIVING INCREASED DEMAND FOR ELECTRICITY ?,emhpam9,t3_bkg3nq,1556983730,1557008930.0,/r/CanadianInvestor/comments/bkg3nq/100_percent_american_portfolio_longterm/emhpam9/
162,Shaun8030,CanadianInvestor,HOW MUCH GROWTH POTENTIAL IS THERE FOR THE SECTORS  YOU MENTIONED INFRASTRUCTURE IS IN PLACE FOR UTILITIES ENERGY WILL BE LESS DEPENDENT ON FOSSIL FUELS  . BRICK AND MORTAR BANKING WILL BE A RELIC OF THE PAST . ONLINE BANKING WILL BE DOMINATED BY GOOGLE AND APPLE IMO AS THEY ARE ALREADY MAKING A PLAY IN THE SECTOR.,emhcfbs,t3_bkg3nq,1556974092,1556999292.0,/r/CanadianInvestor/comments/bkg3nq/100_percent_american_portfolio_longterm/emhcfbs/
163,obiwan2345,CanadianInvestor,"YES THEY CAN, ESPECIALLY WHEN THE REAL OWNER OF THE SHARES YOU BORROWED NEEDS TO SELL THEM. YOU ONLY LOANED THOSE SHARES, SO YOU MUST RETURN THEM TO THE OWNER WHEN THEY WANT TO DO SOMETHING WITH THEM. NORMAL PRACTICE. ALSO, NAKED SHORT SELLING IS EXTREMELY RISKY AND YOU COULD LOSE UNLIMITED AMOUNT OF MONEY. (EXAMPLE: SHORTING APPLE STOCK IN '91 AND STILL IN THE POSITION, YOU WOULD BE BANKRUPT 100000X OVER AND ESSENTIALLY NEVER MAKE MONEY EVER AGAIN IN YOUR LIFE AND PROB BECOME SUICIDAL - JUST DON'T RISK IT...)",em8o4vg,t3_bj8dtd,1556731120,1556756320.0,/r/CanadianInvestor/comments/bj8dtd/questrade_just_covered_3_of_my_short_positions_in/em8o4vg/
164,Matthaus_2000,CanadianInvestor,"TENCENT IS GETTING ON THE CHINESE GOV'T NERVES LIKE HUAWEI'S GETTING ON THE AMERICANS WITH THEIR 5G R&AMP;D PATENTS/ROYALTY LICENCES WHICH CAN RIVAL QUALCOMM, APPLE ETC. 

IF YOU WANT TENCENT I WOULD RATHER YOU PICK HUAWEI OR ALIBABA. 

THE WHOLE ""GAMING BAN"" WAS TO FIRE TENCENT A WARNING SHOT THAT THEY WOULDN'T ALLOW A COMPANY TO CONTROL THE CHINESE INTERNET LIKE GOOGLE. THE WHOLE THING IS LIKE BANNING GOOGLE PLAY/APP STORE FROM SHOWING GOOGLE WHO THE REAL BOSS IS.",elmzo5t,t3_bg692v,1556087796,1556112996.0,/r/CanadianInvestor/comments/bg692v/what_is_your_favorite_undervalued_long_company/elmzo5t/
165,productivehype,CanadianInvestor,ONE OF THE BEST LONG-TERM HOLDS YOU CAN HAVE IN MY OPINION. MINUS THE KRAFT-HEINZ DRAMA OF THE PAST FEW MONTHS THEY HOLD VERY GOOD COMPANIES THAT WILL KEEP GROWING FOR YEARS. BUFFETT IS OLD BUT HE HAS A GREAT LEADERSHIP TEAM TO STEP IN AND CONTROL THE COMPANY LONG-TERM. APPLE IS ONE OF THEIR BIGGER HOLDINGS AND I THINK IT STILL HAS A LOT OF ROOM TO GROW FROM ITS DECEMBER 2018 LOWS OF $142.,el48d0v,t3_be9zvw,1555521872,1555547072.0,/r/CanadianInvestor/comments/be9zvw/thoughts_on_berkshire_hathaway_nyse_brkb/el48d0v/
166,bkn_bitz,CanadianInvestor,STOCKS? I’M NOT TO SURE. I’M NEW TO THIS DO IT YOURSELF INVESTING. I’VE HAD MUTUAL ACCOUNT FOR A WHILE BUT I WANT TO INVEST IN TRANSPORTATION. CAR COMPANIES ARE STRUGGLING RIGHT NOW AND WE MIGHT SEE A SLOW DOWN IN THE INDUSTRY FOR A FEW YEARS SO I’M HOPING TO BUY SOMETHING LOW LIKE LYFT LATELY AND BANK ON TRANSPORTATION CHANGING OVER THE NEXT TEN YEARS. I BELIEVE WE’RE GOING TO SEE A DRASTIC CHANGE IN HOW PEOPLE TRAVEL WITH RIDE SHARING AND LESS PARKING BECAUSE CARS WILL BE UTILIZED MORE OFTEN AND THE INDUSTRY IS GOING TO GO MOSTLY ELECTRIC AND ETC. SOOOO SOMETHING LIKE THAT. I BELIEVE TECH GIANTS WILL GET CONTROL OVER MANUFACTURERS IF IT’S NOT TESLA SOMEBODY WILL FIGURE IT OUT. THE SAME WAY AMAZON NOW OWNS RETAILERS. I’M JUST NOT INTERESTED IN EXPENSIVE STOCKS LIKE APPLE AND AMAZON.,el1ntii,t3_bd5jap,1555444448,1555469648.0,/r/CanadianInvestor/comments/bd5jap/transfer_to_td_direct_investing_from_td_easy_web/el1ntii/
167,svanegmond,CanadianInvestor,"THIS IS A FINE RULE OF THUMB FOR DIVIDEND STOCKS AND SHALL WE SAY “UP AND RUNNING” COMPANIES.  COMPANIES THAT ARE ON A GROWTH TRAJECTORY ARE NOT VALUED THIS WAY.  THE DIFFERENCE IS THAT GROWTH COMPANIES CREATE OR ENTER NEW MARKETS, SO THE GROWTH IS FROM ZERO AND IS 80% A YEAR FOR A FEW YEARS THEN LEVELS OFF AS THE BUSINESS MATURES. IF IT WORKS.

HUGE COMPANIES LIKE APPLE ARE DOING BOTH AND SHUT UP ABOUT HOW THE GROWTH SIDE IS DOING FOR COMPETITIVE REASONS, SO THEY ARE HARD TO ARRIVE AT A VALUATION ON THEM BUT FOR SOME REASON IT’S ALWAYS UNDER 15 PE.",ekv94hz,t3_bcy3uf,1555247191,1555272391.0,/r/CanadianInvestor/comments/bcy3uf/calculating_share_price/ekv94hz/
168,StewVicious07,CanadianInvestor,GOOD QUESTION I WANT TO KNOW AS WELL. I MADE SOME PROFIT ON APPLE. BUT ON QUESTRADE THEY’RE IS NO STATEMENT TO PRINT OFF,ekqtmj0,t3_bci0an,1555099358,1555124558.0,/r/CanadianInvestor/comments/bci0an/us_taxes_to_tsfa_accounts/ekqtmj0/
169,jostrons,CanadianInvestor,"NO THAT'S NOT DIFFERENT AT ALL. IT'S THE SAME AS IF IN MY RBC CANADIAN DOLLAR ACCOUNT I BUY APPLE. SELL IT THEN BUY AMAZON. WEALTHSIMPLE DOES NOT HAVE A USD ACCOUNT SETUP. THEY ONLY HAVE CAD. YOU'RE TALKING MOST BROKERAGES LET YOU OPEN A USD ACCOUNT, BUT YOU'RE NOT COMPARING APPLES TO APPLES, BECAUSE WEALTHSIMPLE DOESN'T OFFER THAT, AND THEY HAVE SAID THEY DON'T OFFER IT.",ekhj44r,t3_bb7vu7,1554832733,1554857933.0,/r/CanadianInvestor/comments/bb7vu7/wealth_simple_trade_not_exactly_free/ekhj44r/
170,ns_guy,CanadianInvestor,"QUESTTRADE DOESN'T EXPLICITLY LIST THE FEE, BUT GOOGLING SHOWS THAT MANY PEOPLE SAY THEY DO THE SAME THING. THEY WILL ONLY SETTLE TRADES IN CAD, SO EVEN IF YOU SAY BUY APPLE STOCK, AND THEN SELL IT YOU CAN'T REQUEST TO KEEP IT IN USD TO LATER BUY MICROSOFT FOR EXAMPLE. THEY WILL INSTEAD CONVERT YOUR FUNDS BACK TO CAD APPARENTLY. OTHER BROKERS, I THINK BMO AND MAYBE CIBC AND TD WILL ALLOW YOU TO HOLD USD ACCOUNTS FOR CASH SETTLEMENT.

WEALTHSIMPLE IS PRETTY CLEAR IN THEIR FAQ THAT THEY INTEND TO MAKE MONEY THIS WAY. I THINK IF YOU ARE LOOKING TO PLAY US TRADES, WITHOUT FX FEES YOU COULD LOOK FOR MAYBE CANADIAN ETFS WITH LARGE EXPOSURE TO THE SECTOR YOU ARE LOOKING FOR INSTEAD AS A PROXY.",ekgypxr,t3_bb7vu7,1554820337,1554845537.0,/r/CanadianInvestor/comments/bb7vu7/wealth_simple_trade_not_exactly_free/ekgypxr/
